fine people on both sides, 18
i 'm at truckpad tower, 18
put a ring on it, 18
the times they are a'changing, 18
action speaks louder than words, 18
i 've just watched episode, 18
i want you to think, 18
i 'm doing my part, 18
professional team owner i leveli, 18
cube access ws race 2020, 18
here is your unroll thread, 18
elops single speed 500 singlespeed, 18
offerta amazon star wars jedi, 18
black neon radio hate you, 18
black neon radio blinding lights, 18
warning misuse of my name, 18
kingdom hearts melody of memory, 18
red hat software collections node.js, 18
a christmas full of hope, 18
black neon radio stay awake, 18
in a world so cold, 18
chipset b550 amd am4 matx, 18
i like your cut g, 18
news rl nord-sd 2020 21, 18
a few more pictures of, 18
make a wish birthday song, 18
i want him so bad, 18
if you know you know, 18
the day i became god, 18
cao headset gamer hyperx cloud, 18
undefined 7.1 grad c undefined, 18
ed plz christmas dlc of, 18
2021 nfl draft player profiles, 18
when your mouth is open, 18
rob-o best of 80 's, 18
vitamin k2 mk7 alltrans 200g, 18
z490-e gaming z490 wifi 6, 18
birth of a new age, 18
u.s. secretary of the interior, 18
the trade in elephants skins, 18
injustice and failure development party, 18
two men at a table, 18
l.a. landscape may 3-11 1962, 18
space jam 2 a new, 18
please do n't be quiet, 18
dvosobni apartman direktno na plazi, 18
i just liked this video, 18
f diesel-hybrid r range extender, 18
a flock of seagulls i, 18
2021 at 02:03pm uah wieda, 18
pull up feat. nile rodgers, 18
this rain will never stop, 18
manager international m w d, 18
download free metatrader forex =>, 18
hate u cuz i do, 18
north rhine-westphalia germany cpp unity, 18
west excerpt from a teenage, 18
taste of honey boogie oogie, 18
dynamics collage tschi tschi by, 18
10 directors to know me, 18
apple music android & under, 18
and then i know love, 18
qris order dm fastrespon wa, 18
d-efei diamond aircraft diamond star, 18
2022 at 10:02am uah wieda, 18
ca cyber f500 + 1., 18
2022 at 08:00am uah wieda, 18
a for $ 1599 link, 18
i draw my life ameli, 18
i at i 04.04. 2022, 18
warm storm 1 $ xtz, 18
vs west ham west ham, 18
the happytime murders dt. ov, 18
manifesto day 1 concept photo, 18
she 's a 10 but, 18
how to build a sexroom, 18
it 's a date german, 18
wifi bt $ 80.00 click, 18
pc snapdragon 625 octa core, 18
ph dimension senkou solo jacket, 18
lba-krk leeds bradford airport to, 18
a year of schocktober challenge, 18
and i danced in triump, 18
an ignorant child a d, 18
hauu,u.3729 nigel smith # #, 18
galaxai was just taken for, 18
set 23 mm l 38, 17
spider man a new universe, 17
good morning and a happy, 17
2019 at 04:01pm uah wieda, 17
save the date am 16, 17
a long long time ago, 17
in a manner of speaking, 17
11 soft cover german cover, 17
i 'm at old town, 17
per lan am router an, 17
i wanna be like you, 17
hylea group s.a. hylea group, 17
careful what you wish for, 17
like i do n't care, 17
can i have this dance, 17
nothing compares 2 u live, 17
i found this offer at, 17
the things i do for, 17
fall in love with me, 17
just sold a superschlampen on, 17
i 'm so fucking sorry, 17
tbh i do n't care, 17
do n't be a pussy, 17
episode iv a new hope, 17
need for speed most wanted, 17
let 's do it again, 17
i 'm at public gym, 17
in german i would say, 17
i did n't do it, 17
when a blind man cries, 17
i did my very best, 17
shine on you crazy diamond, 17
i grip originals by grip, 17
wtf did i just see, 17
icona pop i love it, 17
& a global investment management, 17
do n't mess with a, 17
like i dont get it, 17
voltei i'm backlow battery tho, 17
manager in m w d, 17
galaxy tab e sm-t560 8gb, 17
council on foreign relations ecfr, 17
i fill that with my, 17
let me get this straight, 17
an do u fr 20., 17
dafuq did i just watch, 17
i have no fucking clue, 17
the american way of life, 17
it 's a mad world, 17
am new yorker times square, 17
i can relate so much, 17
im marketing m w d, 17
zombie army 4 dead war, 17
old time rock n roll, 17
i wish you a great, 17
life is a happy life, 17
sorry i 'm not sorry, 17
and call it a day, 17
new microsoft surface go intel, 17
i do n't judge you, 17
who am i to talk, 17
servicedesk supporter m w d, 17
# on # # #, 17
ton qui fait la musique, 17
tha streetz iz a mutha, 17
keep talking and nobody explodes, 17
wrath of the lich king, 17
i want it so bad, 17
langematik perpetual 310.026e sz included, 17
price eur29.90 ship price 4.90, 17
last christmas i gave you, 17
lets give it a try, 17
mm item number 15108 vendor, 17
price eur17.74 ship price 5.00, 17
price eur19.36 ship price 5.00, 17
r13 item number phone vendor, 17
it 's not that deep, 17
you will never walk alone, 17
nooo i 'm so sorry, 17
oh i 'm so sorry, 17
baso item number 15108 vendor, 17
monster energy supercross the official, 17
can become a great coach, 17
full hd 1920 x 1080, 17
what the fuck is a, 17
which side are you on, 17
was a rollin ' stone, 17
kd item number 15108 vendor, 17
and herda share a dick, 17
first snow in the alps, 17
never change a running system., 17
the catcher in the rye, 17
alco power fighter apf 6-u-hr, 17
we wish you a merry, 17
3 games in a row, 17
allnet flat classic 9 gb, 17
a dog 's tale 2009, 17
calamity of a zombie girl, 17
no war but class war, 17
i love what i do, 17
i just do n't know, 17
i mean look at you, 17
is hiring remotely for a, 17
hate to break it to, 17
> has been published on, 17
cube access ws eaz 2020, 17
2020 at 06:01pm uah wieda, 17
the god of high school, 17
holding pattern alert2 at time, 17
i will try my best, 17
swiss national covid-19 science task, 17
you on the other side, 17
black neon radio una notte, 17
you have a crush on, 17
i do n't wanna leave, 17
berlin has been published on, 17
lft as a solo bin, 17
i was all over her, 17
to build our for a, 17
mullwi item number phone vendor, 17
deep c 22 narrow tall, 17
twist of a love affair, 17
one + series x s, 17
order dm or klik wa, 17
undefined 6 grad c undefined, 17
provides update on exploration at, 17
subscribe to all channels got7, 17
price 17.99 ship price 4.95, 17
business transformation as a service, 17
2021 at 01:01pm uah wieda, 17
starting at 280,00 shop now, 17
i love to be shaved, 17
2021 at 01:02pm uah wieda, 17
i do n't speak brainwash, 17
luck banging or loony porn, 17
2021 at 01:00pm uah wieda, 17
a world of little legends, 17
immortalizes late ex-imo military gov, 17
in stock global version poco, 17
0 fax 49 0 30, 17
nokton classic 35mm f 1.4, 17
god 's kingdom is coming, 17
6b parameter text generation model, 17
2021 at 03:03pm uah wieda, 17
ebc front brake disc vee, 17
meet the woo 2 type, 17
2021 at 12:02pm uah wieda, 17
boy road to 100m #, 17
i 'm a and love, 17
waveflyer aggro freestyle music u.a, 17
got reviewed scored 5 5, 17
live stream follow & reetweet, 17
i got a feeling ft, 17
barry lyndon piano trio in, 17
checker reason in _ stock, 17
new video by dave gaming, 17
mountain & co i acquisition, 17
also my bitcoin got hacked, 17
+ nas system 4-bay precio, 17
horizon call of the mountain, 17
color a size l code, 17
a for $ 1636 link, 17
a for $ 1539 link, 17
- disney + shar 1bln, 17
for you i will by, 17
i got two in kp-ink, 17
kiwi artwork artwork by artwork, 17
women in fashion germany event, 17
bigger bigger get from here, 17
neutral aur sachha fact checker, 17
art digitally signed get your, 17
not even a number surviving, 17
i get free usdt on, 17
to download use the link, 17
but for the first time, 17
liverpool manchester city b &, 17
streaming online vs bayernmunich wch, 17
and it was all discovered, 17
v3 cpu x 2pcs and, 17
bmfd,u.7125 sampson thackeray # #, 17
rlbb,a.5061 sidney zechariah # #, 17
watch my new hot videos, 17
just be good to me, 16
style 4 = 0815 5, 16
wish you a nice sunday, 16
shout it from the rooftops, 16
2019 at 08:01am uah wieda, 16
i do n't really know, 16
& wizard vape 's pg, 16
the time of my life, 16
kiezmarkthalle wrote a new post, 16
building information modeling i management, 16
is a modern disco dream, 16
only god can judge me, 16
is the way to go, 16
drinking a premium altbier by, 16
cover a blu-ray + dvd, 16
web developer m w d, 16
a wall is a screen, 16
queen a kind of magic, 16
for 4 keyboards in a, 16
u do n't even know, 16
i 'm on a roll, 16
i could be the one, 16
omg omg omg omg omg, 16
e-class power steering pump oem, 16
let 's wait and see, 16
do n't look back in, 16
there is a german saying, 16
all you can eat restaurant, 16
children of blood and bone, 16
would n't change a thing, 16
a tale of two sons, 16
when i kissed the teacher, 16
rockin in the free world, 16
it must have been love, 16
i do n't get that, 16
but who am i kidding, 16
a charming charmander bookmark for, 16
let 's go for it, 16
whitesnake here i go again, 16
phone hungarian dances no21 in, 16
i think we have a, 16
drinking a simco 3 by, 16
economy a framework and research, 16
10.1 inch 3gb + 32gb, 16
love it or leave it, 16
like a candle in the, 16
of my websites kaufsimkilo berlin, 16
incoming in 3 2 1, 16
sum humani nihil a me, 16
battle against a true hero, 16
carey room with a view, 16
and i 'm just like, 16
triumph sprint st 955 i, 16
i do n't deserve this, 16
shining city on a hill, 16
tetzlaff presents a handsome re, 16
i 'm living for it, 16
the artist formerly known as, 16
medium scale just a nut, 16
i know that you know, 16
kouri no you ni hiyayaka, 16
i miss her so much, 16
i 'm proud of u, 16
do n't mention the war, 16
burgh the lady in red, 16
i 'm at ibis budget, 16
take a look at the, 16
lady gold on lady gold, 16
the yellow from the egg, 16
president of the united states, 16
lets go for a walk, 16
i wank i cum isquirt, 16
shine a light on me, 16
i have so many questions, 16
how to be an antiracist, 16
i have no fucking idea, 16
1 item number phone vendor, 16
n't be the only one, 16
bubble i need your help, 16
have i told you lately, 16
once in a life time, 16
is a state of mind, 16
horn item number 15108 vendor, 16
dance monkey tones and i, 16
a quick wank during lunchbreak, 16
price eur29.95 ship price 3.95, 16
strike item number phone vendor, 16
job m w d in, 16
performing artist please give a, 16
scotch & soda deal maker, 16
songs for a new world, 16
jeans hose slim fit denim, 16
one nation under a groove, 16
bond no time to die, 16
word of the day from, 16
what a nice cat rt, 16
official hd version aggro berlin, 16
philh the four seasons violin, 16
against nonjews is a duty, 16
school of management and law, 16
the left ca n't meme, 16
just sold a joi games, 16
map of the soul 7, 16
not to be horny on, 16
love the way you lie, 16
and now something completely different, 16
this could be us but, 16
i 'm in this tweet, 16
oops we did it again, 16
we love to see it, 16
is the greatest nigerian player, 16
photo from g _ briellejkt48, 16
cube access ws exc 2020, 16
on a dirty old man, 16
a crown for the wonderboy, 16
how to lie with statistics, 16
venom let there be carnage, 16
geox sneakers low blinkies android, 16
darkwave-sounds the last four days, 16
and i kid you not, 16
darkwave-sounds all we ever wanted, 16
alziraspa beauty & wellness waxing, 16
darkwave-sounds 05 walkin the wire, 16
black neon radio dance monkey, 16
hijo a wild west tale, 16
the dark side of big7, 16
live now plug & play, 16
human work s talk am, 16
black neon radio keep on, 16
imagine wearing this spy sunglasses, 16
judge me in a year, 16
inventory manager m w d, 16
hammer an eighth goal past, 16
i am there gardas. live, 16
top transfer sane top scorer, 16
kemp country leader oracle germany, 16
the tiger lillies-start a fire, 16
stillk item number phone vendor, 16
undefined 6.2 grad c undefined, 16
sackboy a big adventure tridonax, 16
smart android tv philco led, 16
excuse me i love you, 16
's live in good night, 16
a very british tea time, 16
rive red line 90 ml, 16
digital-check smartphone internet social media, 16
2021 at 11:00am uah wieda, 16
two and a half fan, 16
2021 at 05:02am uah wieda, 16
football for friendship eworld championship, 16
one of a group 1955, 16
cyber security w m d, 16
vote hard and stream hylt, 16
dm or wa link on, 16
excuse me feat. soffy o., 16
2021 at 09:01pm uah wieda, 16
's first transgender cover model, 16
< phone >/ pd 2pcs, 16
i 'm live now coffeestream, 16
e.v. by donating or retweeting, 16
vitamin d3 + k1 &, 16
color a size m code, 16
backup by a project other, 16
slim fit smoking custom blazer, 16
a for $ 1544 link, 16
this is a call from, 16
in a nutshell random dude, 16
i was suggesting to bomb, 16
evening with the moonflower society, 16
psych herausford. stress hautprobl. immunsyst., 16
by a project other back, 16
laptop cooler cpu fan for, 16
a series of modern surveys, 16
less backfree full garansi payment, 16
live stream sporting vs tottenham, 16
international talk about cancer day, 16
regan fred aubrey johnston e, 16
s7ttvhowkt liverpool vs rangershttps t.co, 16
god i am so fucking, 16
cameras smartphone $ 448.81 click, 16
wifi bt $ 59.04 click, 16
ljss,u.3217 kent swinburne # #, 16
x tv en us pt, 15
just a matter of time, 15
life is strange 2 episode, 15
not all heroes wear capes, 15
knockout tie as liverpool manager, 15
2019 at 05:01am uah wieda, 15
phone full service mandi kucing, 15
i do n't know what, 15
life is but a dream, 15
it 's a kind of, 15
sex scents and rock'n'roll melt, 15
where did i go wrong, 15
where the wild roses grow, 15
how can i help you, 15
who the hell am i, 15
you get what i mean, 15
never chance a running system, 15
we need to talk about, 15
2 and a half man, 15
not to be that bitch, 15
pls help a girl out, 15
i 'm at ice international, 15
knast-soli-goe wrote a new post, 15
just to let you know, 15
jews will not replace us, 15
this is why i love, 15
old macdonald had a farm, 15
thank god it 's monday, 15
support a creator code getonmylvl, 15
i 'm at hotel am, 15
is a too small country, 15
it 's that time again, 15
i do n't want this, 15
as good as it gets, 15
i do n't care with, 15
official music video afm records, 15
never change a running team, 15
box milpaz fit boxing 1, 15
sorry i dont speak german, 15
last night of the proms, 15
i have just listed 100, 15
a link to the cast, 15
what more can i say, 15
i want to fuck you, 15
never change a losing team, 15
i 'm at chocolate museum, 15
i 'm really feeling it, 15
crow all i wanna do, 15
i can deal with it, 15
i 've got a friend, 15
live im nba league pass, 15
in the us of a, 15
horn | s-o-m-m-e-r radio teddy, 15
n social media manager in, 15
so good so good dagagago, 15
418 i 'm a teapot, 15
let 's talk about it, 15
i 've seen it all, 15
when a child is born, 15
bye have a great time, 15
there 's no business like, 15
i do n't know yet, 15
's modern cabin for artist, 15
p.s i still love you, 15
'll keep my fingers crossed, 15
i left my heart in, 15
these boots are made for, 15
every picture tells a story, 15
i 'm so happy rn, 15
we wish you a pleasant, 15
everytime i look for you, 15
i think i love you, 15
i 'm at h scharoldstr, 15
i like it very much, 15
it 's friday i 'm, 15
we call it a classic, 15
price eur16.46 ship price 5.00, 15
fifty shades darker in vancouver, 15
girls bend at the waist, 15
it 's the little things, 15
price eur15.46 ship price 5.00, 15
i 'm at five guys, 15
from mielck e. symphony in, 15
i can hear your voice, 15
family & friends e v., 15
this did n't age well, 15
r14 item number phone vendor, 15
price eur71.84 ship price 5.00, 15
original floater rapala original floater, 15
i mean i love it, 15
i got five on it, 15
i really do n't get, 15
price eur59.95 ship price 3.95, 15
i still ca n't believe, 15
what do i do now, 15
two and a half women, 15
two beauties and single cock, 15
ebony teenie wishes for wild, 15
price eur34.95 ship price 3.95, 15
i do not get it, 15
german soldier song + englis, 15
2021 tesla model y vs., 15
i wanna hold your hand, 15
930 item number 119c000930ndx0001-c0001 vendor, 15
8924 item number phone vendor, 15
's face not to love, 15
be quiet speedlink runtime instant-gaming, 15
black indigenous people of color, 15
we are the news now, 15
in germany we would say, 15
i 'm out for today, 15
music to be murdered by, 15
i mean i get that, 15
a quiet place part ii, 15
use it or loose it, 15
how to hear a painting, 15
smiling face with 3 hearts, 15
skype blackmail findom slave feet, 15
ey i 'm so sorry, 15
you know what to do, 15
work done time for a, 15
i 'm back on track, 15
is an author. is a, 15
to a live machdichwahr heit, 15
i may not show it, 15
civilization 6 let 's plays, 15
geox baby sneakers low blinkies, 15
i will always be there, 15
fake news a la trump, 15
have a look and enjoy, 15
omni-directional wireless lavalier microphone system, 15
u-dimm desktop memory cl16 ax4u300038g16a-dt60, 15
darkwave-sounds fear of the dark, 15
darkwave-sounds all over the world, 15
understandable have a great day, 15
office for national statistics ons, 15
alter.nation a dozen bestofs 0, 15
darkwave-sounds v pustotu into emptiness, 15
it 's me i am, 15
black neon radio your mind, 15
black neon radio in the, 15
i had to do it, 15
black neon radio savage love, 15
things i wanna do this, 15
alter.nation.mix a dozen bestofs 28-06-2020, 15
in a b dk nl, 15
black neon radio remember when, 15
vertical manoeuvring alert at time, 15
a ghost in the throat, 15
mind 3 o 5 +, 15
domain of one 's own, 15
center for feminist foreign policy, 15
like me i am famous, 15
reply for a rating 1, 15
i 'm fine with it, 15
i feel you very much, 15
green new deal </ i, 15
kaizer chiefs epl manchester united, 15
maddnext makes no sense without, 15
three liberals and a monkey, 15
essay-coronavirus do 's and do, 15
babypflegesets item number phone vendor, 15
three lions on a shirt, 15
as a german i say, 15
21 playstation 4 xbox one, 15
that i could n't keep, 15
undefined 6.7 grad c undefined, 15
vend & eaigu e globe, 15
teilig beach city stonwall lanscape, 15
would i meet you irl, 15
greece 20 drachmai 1944 p, 15
it 's computer love -, 15
1 btc = 1 btc, 15
on s5 rg-016 mokrc 1059m, 15
% discount be a leader, 15
apple iphone 12 mini 64gb, 15
2021 at 06:00pm uah wieda, 15
later mme r. berenger 1887, 15
get it for20.00 us $, 15
2021 at 10:01pm uah wieda, 15
memories for return to travel, 15
get it for23.00 us $, 15
stragewicz as a child 1887, 15
post your oldest amazon order, 15
spray 150 ml 1 st, 15
layout 5k 3 layout jpg, 15
wts want to sell lfb, 15
germany was just sold for, 15
the lily-time calendar a guiding, 15
1 a win for and, 15
join me in my space, 15
an raspberry pi 4 4gb, 15
ac as a midfielder game, 15
sound of the year 2021, 15
shirts sweaters hoodies u.v.m spare, 15
u beautiful ginger city girl, 15
am i losing you forever, 15
morrison & mackay 47,5 %, 15
14:00:00 find out more at, 15
15:00:00 find out more at, 15
ot7 group non pvc 25k, 15
chico senior high school ca, 15
benton hbn bk the sssnake, 15
every song i ever wrote, 15
signatures 2x edp im 100ml, 15
adidas predator freak 1 low, 15
en image la fresque envol, 15
inside a white supremacist militia, 15
a for $ 1046 link, 15
vs burnley live stream link, 15
a friend of the family, 15
2022 at 04:02am uah wieda, 15
darling give me a break, 15
impdie top 1 im sep, 15
eu corporate sustainability reporting directive, 15
give my playlist a listen, 15
playoff hall of fame class, 15
it 's a wonderful story, 15
do we have a pwoblem, 15
card game shoulder bag book, 15
prime b560m-a ac intel b560, 15
hair dryer alyon 1 u, 15
new bitcoin video on youtube, 15
e wallet + qris testi, 15
android 6 mt8163 cpu wifi, 15
nightlife and a unique stadium, 15
bebb order by dm wa, 15
+ bulk order + dropshiper, 15
suit gundam the witch from, 15
online newtop story wm 2022, 15
+ rate testihttps :// t.co, 15
moore clement haley cook e, 15
news anchor has died a, 15
which we got was divil, 15
hdjz,e.3228 lynn holt # #, 15
5 jobs i had 1, 14
a seat at the table, 14
5 scramble the phantom strikers, 14
this one is for you, 14
i 'm at best carwash, 14
were also brother freemasons the, 14
our next meeting is at, 14
i 'm at h zoo, 14
just left a comment on, 14
song of ice and fire, 14
o lord hear my prayer, 14
i 'm at demel k.u.k, 14
instagram such a time saver, 14
phone hungarian dances no9 in, 14
come a little bit closer, 14
packsack ca 50 x 25, 14
fullstack developer m w d, 14
too good to go app, 14
the benefit of the doubt, 14
junior consultant m w d, 14
prelude to act i solti, 14
with relics sponge lower left, 14
oops they did it again, 14
the curse of monkey island, 14
drinking a palim palim pale, 14
have a great weekend everyone, 14
ux designer m w d, 14
padowatch wrote a new post, 14
drinking an edelsud premium by, 14
i 'm at north pub, 14
long live rock n roll, 14
that 's how i roll, 14
was it something i said, 14
what am i doing here, 14
keep it in the ground, 14
well i do n't know, 14
i hate to break it, 14
and i 'm loving it, 14
i see what you did, 14
wish i could be there, 14
string quartet in e flat, 14
heeey guys i 'm hoorny, 14
online a plague tale innocence, 14
i hope you 're okay, 14
lady is a tramp the, 14
guardians of the galaxy 3, 14
working group i the scientific, 14
do they know it 's, 14
i 'm sorry zero points, 14
ne once in a lifetime, 14
to name just a few, 14
all i ask of you, 14
i do it for you, 14
super kinky german female writer, 14
lewd yandere former dragon goddess, 14
a closed and common orbit, 14
dong the witch is dead, 14
kabaneri of the iron fortress, 14
variations on a theme by, 14
i just wanted to say, 14
stanford university school of medicine, 14
i mean i take it, 14
i am sorry for you, 14
i wish that were me, 14
galaxy tab a 2019 32gb, 14
am a & w blog, 14
you need to calm down, 14
i 'm so happy for, 14
but wait there 's more, 14
windows administrator m w d, 14
i do n't know tbh, 14
first world problems i know, 14
tt isle of man 2, 14
think out of the box, 14
manson third day of a, 14
i 'm at h &, 14
a year ago we published, 14
one thing at a time, 14
i 'm not dead yet, 14
a dog market coming to, 14
a bit of fry and, 14
a special kind of stupid, 14
10 do i like you, 14
pres. by o'neill rd9 h3, 14
who gives a fuck about, 14
just the two of us, 14
fear of a blank planet, 14
i do n't get this, 14
i 'm the queen of, 14
ouran high school host club, 14
on a whole new level, 14
video killed the radio star, 14
the people vs. o.j simpson, 14
i 'm on the way, 14
take a look at this, 14
blood & honour combat 18, 14
books on demanderscheinungsdatum 4.02.2019format e-buchtextseiten, 14
gravando the marvelous mrs. maisel, 14
solo le pido a dios, 14
live im tv & stream, 14
this is not a test, 14
is a castle in lower, 14
i cant stress this enough, 14
price eur19.33 ship price 5.00, 14
a woman under the influence, 14
price eur20.69 ship price 5.00, 14
the import of trophy-hunted lions, 14
how to read a paper, 14
3 item number phone vendor, 14
15x20 item number 15108 vendor, 14
limiter item number 15108 vendor, 14
system of a down live, 14
if i fits i sits, 14
yoda waitingroom weiting in a, 14
chess pgn game match played, 14
lowest ask $ 49950 a, 14
langematik perpetual 310.025 sz included, 14
sep22 i tried almost all, 14
no rest for the wicked, 14
nude male model academy study, 14
you 've got a point, 14
i am at my limit, 14
i 'm at al zain, 14
12330 item number 21012330-403 vendor, 14
i 'm on a mission, 14
sex goddess teenie banged hard, 14
time person of the year, 14
i wish i could help, 14
not to be a hater, 14
20 inch spyder rs velgen, 14
you cant get out of, 14
have a look at my, 14
price eur17.95 ship price 3.95, 14
date a live the movie, 14
i cant get no sleep, 14
patch 5.2 echoes of a, 14
iam security consultant m w, 14
game shot and the match, 14
i 'm a bad bitch, 14
strategic lawsuit against public participation, 14
by josh 's almighty castle, 14
the best of both worlds, 14
medneo is looking for a, 14
hate is all i feel, 14
skechers is looking for a, 14
palmaia the house of aia, 14
what i 'm saying is, 14
it 's time to go, 14
g instagram fb art page, 14
% growth how to buy, 14
rt game 5 5 5, 14
fuck i 'm so sorry, 14
very late to the party, 14
happy international women 's day, 14
freedom is a constant struggle, 14
4 games that define u, 14
what am i gonna do, 14
skateboard complete 100 gradiant parrot, 14
u body to body massage, 14
c ash d ealer u, 14
hey,wanna be a gramstar link, 14
not to be a simp, 14
send me a little light, 14
u nebula a sneakers low, 14
capitalism is a death cult, 14
6 things i like 1, 14
when i was your age, 14
tights run dry + feel, 14
a way out lets play, 14
rude rider lubes a 50, 14
darkwave-sounds end of the time, 14
darkwave-sounds darkness out out remix, 14
darkwave-sounds call the ships to, 14
black neon radio silver bullets, 14
if i were an animal, 14
i 'm at jet textilservice, 14
darkwave-sounds end of the world, 14
darkwave-sounds never enough alternate mix, 14
black neon radio if i, 14
darkwave-sounds my release in pain, 14
black neon radio the great, 14
black neon radio escape reality, 14
to list a bitcoin-backed etp, 14
black neon radio rebel yell, 14
black neon radio come on, 14
for a nude vid in, 14
property manager m w d, 14
your nickname in my mind, 14
black neon radio friday flight, 14
eternal power of a woman, 14
an episode from kicker meets, 14
open source process mining software, 14
black neon radio ganorium voyage, 14
meiko superpad 20 508 mm, 14
former anthem of switzerland a, 14
no one gives a shit, 14
do n't smile at me, 14
how should a person be, 14
over the moon for you, 14
originals a discovery of witches, 14
by durma hd-f 3015 phone, 14
molicare premium fixpants long leg, 14
gvi680 he mfc 100ml 0.7mpag, 14
single convention on narcotic drugs, 14
e-health innovation m w d, 14
lets have some fun together, 14
akq expires flood warning for, 14
what else can i do, 14
starting at 200,00 shop now, 14
preliminary r & d 11.2, 14
open verif indosat dm langsung, 14
most affected people and areas, 14
no 2 apr 1916 1916, 14
get it for22.00 us $, 14
core web vitals q &, 14
i promised you the moon, 14
i 'm at fitness lounge, 14
