Total number of 5 token islands,876904
Top 10000 with counts,:
amazon de stock changed from, 17428
de has been published on, 9072
two and a half men, 3344
a clever man commits no, 3132
i do n't get it, 2543
code has been published on, 2486
a link to the past, 2347
all i want for christmas, 2039
i starred an episode from, 1944
this is a fan favorite, 1762
look what i found on, 1750
never change a running system, 1643
spain vs germany live stream, 1631
i do n't like the, 1470
ertel automobile & computer phone, 1433
false valign top align right, 1180
dragon ball z dokkan battle, 1089
you can read it here, 1044
please find the unroll here, 1026
lynch rosalind brewer vicki hollub, 981
i heard it through the, 978
the unroll you asked for, 926
group is looking for a, 915
name a corner of the, 896
i do n't think so, 857
oss wide-angle zoom lens sel1018, 854
a horse with no name, 852
never change a winning team, 816
i say a little prayer, 814
the seminar & co daily, 744
the internet of things daily, 737
so am i bb radio, 723
on her zisit to sh.ngh.i, 711
multi daybreak blazer mid dunk, 707
new tumblr post favorite tweets, 654
jewel digipack album nct wayv, 642
i was today years old, 638
oops i did it again, 634
i want it that way, 624
i want you to panic, 618
massage in juffair phone 8765, 604
hpa trend 0.1hpa hr rel, 600
one day at a time, 597
top story the daily news, 587
do n't get me wrong, 580
i will always love you, 576
hpa trend 0.2hpa hr rel, 554
would i lie to you, 545
the fu r o x, 530
the fu y o x, 520
build a house bb radio, 515
i do n't feel hate, 512
and i think that 's, 502
the fu w p x, 494
the fu t o x, 490
the fu e o x, 484
you know what i mean, 471
it is a bubble 1.54, 471
the fu y p x, 468
the fu e p x, 467
the fu r p x, 466
krokodeal has been published on, 465
hpa trend 0.3hpa hr rel, 460
it is a bubble 1, 460
i said what i said, 457
the fu w o x, 456
black neon radio oliverk live, 455
you 'll never walk alone, 454
published a new blog entry, 452
the fu t p x, 452
4.0 android 11 wireless android, 447
ai box wireless apple carplay, 447
the fu u p x, 447
wallet & qris fastrep wa, 439
i want to break free, 430
i know what you mean, 426
i wish you were here, 423
noches good night buona notte, 411
mike 's daily photo digest, 409
as far as i know, 408
vinyl news daily out now, 407
the show must go on, 396
i 'm looking at you, 396
the almighty i dreamed about, 395
false valign top align left, 394
tail flt owner aircraft g-115, 392
the last of us part, 391
item number phone > vendor, 389
i believe i can fly, 384
call of duty modern warfare, 383
i do n't like mondays, 377
men dress made in u, 373
watch now live stream link, 354
see a review for the, 353
dvd item number phone vendor, 351
vs arsenal live stream link, 348
i want to eat your, 345
sandy beerbohm zachary dewey haley, 345
i could n't care less, 344
and when i clap back, 344
so am i radio teddy, 342
who am i to judge, 340
hi get $ 500 daily, 339
feet footfetsh footfetsh blackmail moneydom, 339
hpa trend 0.4hpa hr rel, 336
never touch a running system, 334
oh yeah i love it, 332
topseller has been published on, 328
used by the jews of, 326
of a lady on fire, 323
the fu p # #, 316
and the will of the, 312
i am what i am, 308
i love you so much, 299
your nickname in my head, 299
the fu u # #, 299
take a chance on me, 295
a good place to smoke, 290
has a new log write, 288
now phone 8765 massage sex, 288
hpa trend 0.0hpa hr rel, 286
the fu o # #, 285
the fu x # #, 284
i feel you so much, 283
the tiger took my family, 282
dum di dum di dum, 282
two and a half man, 280
the fu e # #, 279
solo a star wars story, 278
i love rock n roll, 276
stay a while and listen, 275
featured art of the day, 275
call me by your name, 274
friday i 'm in love, 274
marriage watch from a 1876, 273
thanks for the kind words, 272
i support the current thing, 271
magic fm wake up call, 270
i am not your negro, 270
how to sell drugs online, 269
what could possibly go wrong, 263
mbw has been published on, 262
check out what i found, 261
1bln fam 6 bln 4ok, 254
16.6.1993 gem abschn ii nr., 253
i do n't care anymore, 251
hpa trend 0.5hpa hr rel, 249
i just added klt live, 248
nothing breaks like a heart, 247
i like to move it, 247
like me i 'm famous, 247
online-marketing social media marketing smm, 244
rt videos in my profile, 242
now available at gaming desktop, 242
good morning in the morning, 241
ur nickname in my head, 241
i did it my way, 239
our daily bread ministries e.v, 239
> generic half b $, 239
good night and good luck, 236
once upon a time in, 234
i dont give a fuck, 231
high gloss lacquer kitchen cabinet, 228
i wanna dance with somebody, 227
kz0ev5ooys liverpool vs rangershttps t.co, 227
the devil is a part-timer, 225
en vivo how to watch, 224
i wanna be your slave, 223
holding out for a hero, 222
tell us about yourself 1, 221
i want my money back, 219
delivers always top service n, 218
a gif of your favorite, 217
magic fm late night beats, 216
top 50 video focus online, 216
i 'm at s +, 211
stands to his word period, 210
programming diagnostic tool all-in-one key, 210
this is not a drill, 204
i 'm standing on a, 202
war and wit heroes origin, 200
5 of 5 stars to, 199
4 of 5 stars to, 199
is a place on earth, 198
dpt. is looking for a, 197
to whom it may concern, 196
hello here is your unroll, 195
< phone 4131 58 bic, 195
live streaming link computerhttps t.co, 195
bathtub u shape tipping trailer, 194
600 gaming headset and gsx, 193
the times they are a-changin, 192
new post in pg news, 192
wall street i opening bell, 192
we live in a society, 191
i do n't give a, 191
perks of being a wallflower, 189
build a house radio teddy, 189
rituals is looking for a, 188
i do n't know why, 187
nsx type r na1 stock, 187
the winner takes it all, 186
i 'm at belluss coffee, 185
same procedure as every year, 184
a walk in the park, 183
's not just a cutie, 183
my life in a nutshell, 182
i mean i get it, 182
ebfy3vzugm liverpool vs rangershttps t.co, 182
i deserve a date with, 178
how to save a life, 176
hpa trend 0.6hpa hr rel, 176
payment all e-wallet & qris, 176
u know what i mean, 173
the last of us 2, 172
i spit on your grave, 171
i 'm at h u, 171
999 fax 0800 56 66, 171
8-kern amd fx-8300 geforce gt, 170
is matt defoe # #, 170
i do n't fucking care, 167
trusted1000 % full garansi aman,legal, 166
by 1800 guns n ammo, 166
live stream ca | |, 166
i hate to say it, 164
yes sir i can boogie, 164
shine bright like a diamond, 163
i 'm at u +, 163
like the way i do, 162
drinking an export hell by, 161
see what i did there, 161
love is in the air, 161
wireless carplay module box for, 161
500 futures crypto crypto news, 159
five jobs i 've had, 157
my phone is was iphone, 155
it is a bubble 1.42, 153
i fixed that for you, 150
celebrities + comedians ++ neilmacgregor, 150
let 's follow each other, 150
supports the idea house of, 149
life is a bitch bitch, 149
it is what it is, 149
i vote for at the, 149
based on a true story, 148
i fixed it for you, 148
jeckech jeckhem agrippa do socorro, 148
engineering it & it-consulting finance, 147
developer week 2020 dwx 2020, 147
wallet wihtdrow airdrop / token, 147
i crumble around my photo, 146
gilbert flower burke herty #, 146
it 's been a while, 145
orange is the new black, 145
has been published on chineselgz, 145
jenny o'neil # # #, 145
thanks for the mention you, 144
007 fax 0800 56 66, 144
i 'm ready for my, 142
2020 at 10:00am uah wieda, 142
2020 at 07:00pm uah wieda, 142
2020 at 09:00pm uah wieda, 142
start _ ad _ break, 142
and i think thats beautiful, 141
skype blackmail findom slave sub, 141
2020 at 08:00pm uah wieda, 141
stranger in a strange land, 140
it 's a wonderful life, 140
how to be a hero, 140
2020 at 10:00pm uah wieda, 139
a view to a kill, 138
pretend it 's a city, 138
just chatting i i fun, 138
bill # u rosalind macadam, 138
ooh wee ft. nikki-o soulphiction, 137
2020 at 11:00am uah wieda, 137
2020 at 05:00pm uah wieda, 137
my heart will go on, 136
do n't give a fuck, 136
gene lizzie cyril humphr e, 136
i 'm proud of you, 135
today 's youtube trend is, 135
'll do my very best, 135
a tale of golden keys, 135
i have a st dream, 135
i 'm at the fifties, 134
i could n't agree more, 134
boom boom boom boom boomerang, 134
what if i told you, 133
i got 5 on it, 133
2020 at 06:00pm uah wieda, 132
u.s. national library of medicine, 132
dan sandy o'neil # #, 132
king of rock n roll, 131
i mean look at this, 131
system change not climate change, 130
phone wallpaper # # #, 130
habermas' obituary to friend and, 130
i 'm at kieser training, 129
the cake is a lie, 129
i can see your voice, 129
our hashtag results toxic election, 129
handley high school roanoke al, 129
x1500 nyc catch a dragon-type, 128
for a second radio teddy, 128
>) has been published on, 128
another content item sold on, 127
2020 at 11:00pm uah wieda, 127
if i had a hammer, 126
promo code is required type, 126
rock edm r & b, 125
au jour le jour n1, 124
2020 at 03:00am uah wieda, 124
i 'm at norwich railway, 123
help is on the way, 123
hell in a cell match, 122
big brother is watching you, 122
the times they are a, 122
i do n't like it, 122
i 'm a simple man, 122
2020 at 02:00am uah wieda, 122
wtf did i just read, 121
a change is gonna come, 121
vs sporting cp live link, 121
2020 at 04:00am uah wieda, 120
one step at a time, 119
kontofick worship rtgame melkrad melkspiel, 119
i 'm gonna carry this, 118
a man and his cat, 118
why famous influencers recommend whitestone, 118
jual youtube wtb youtube premium, 118
dance i took a pill, 118
cisco annual security report link, 117
2021 at 08:00pm uah wieda, 117
i to me sister suke, 117
2020 at 09:00am uah wieda, 116
my roommate is a cat, 115
prism is a dancer show, 115
2020 at 04:00pm uah wieda, 115
by hacker-pschorr untappd at home, 115
number 4 in e flat, 114
2020 at 05:00am uah wieda, 114
pyur has been published on, 114
collection layout ready stock scenery, 114
2019 at 02:00am uah wieda, 113
a tale of two cities, 113
we build a sustainable future, 113
rock you like a hurricane, 113
hola here is your unroll, 113
it 's a beautiful day, 112
at saintlaurent pfw exyslparisfw #, 112
2019 at 08:00pm uah wieda, 111
sex drugs and rock'n roll, 111
i mean look at him, 111
a galaxy far far away, 111
2020 at 12:00pm uah wieda, 111
i am the i am, 111
can you split the bill, 111
is it free for students, 111
2019 at 07:00pm uah wieda, 110
2019 at 09:00pm uah wieda, 110
'd do anything for love, 110
why am i like this, 110
i am looking at you, 110
'll be there for you, 110
2020 at 03:00pm uah wieda, 110
a relationship should be 50, 110
a for $ 1719 link, 110
germany fears britain after brexit, 109
gold by untappd at home, 109
tv 40 nr. 2 here, 109
super service | a wolf, 109
2019 at 11:00pm uah wieda, 108
i might go to at, 108
2020 at 02:00pm uah wieda, 108
helps constantly & solid a, 108
has just world class service, 108
we need a new system, 108
i 'm at dormakaba ag, 108
vsvsfhvfa0 liverpool vs rangershttps t.co, 108
gale o'neil norman webster payne, 108
2019 at 10:00am uah wieda, 107
2019 at 05:00pm uah wieda, 106
2019 at 06:00pm uah wieda, 106
2019 at 04:00am uah wieda, 106
2019 at 11:00am uah wieda, 106
%) has been published on, 106
2020 at 01:00am uah wieda, 106
2019 at 10:00pm uah wieda, 105
i love it so much, 105
2019 at 03:00am uah wieda, 105
2019 at 01:00am uah wieda, 105
good guy with a gun, 105
stands behind his word a, 105
error was encountered severity notice, 105
2019 at 09:00am uah wieda, 104
holding pattern alert at time, 104
red hat openshift container platform, 104
nonton live yo di 5, 104
russia is a terrorist state, 104
let 's play a game, 103
2021 at 05:00pm uah wieda, 103
payment all e-wallet + qris, 103
gerald lizzie lorraine o'casey #, 103
i 'm not gonna lie, 102
bri qris seabank fast order, 102
2019 at 03:00pm uah wieda, 101
i really do n't know, 101
wanyama dier skipp sissoko winks, 101
let 's have a party, 101
clone a willy dildo kit, 101
be a lady they said, 101
inbox no spam no scam, 101
wall street i closing bell, 101
a for $ 1799 link, 101
real betis vs ludogorets as, 101
2019 at 12:00pm uah wieda, 100
sales manager m w d, 100
i know what u mean, 100
tom clancy 's rainbow six, 100
2019 at 05:00am uah wieda, 99
flood the zone with shit, 99
a pain in the ass, 98
king in a lab coat, 98
age is just a number, 98
for a second bb radio, 98
2022 at 05:00am uah wieda, 98
bieber dance video mihran kirakosi, 97
i love you always forever, 97
i 'm on my way, 97
a day in the life, 97
2 and a half men, 97
trusted all e-wallet qris dm, 97
2019 at 08:00am uah wieda, 96
a series of unfortunate events, 96
i 'm not in love, 96
but i do n't care, 96
lies of the beautiful people, 96
world restart a heart day, 96
one of my favorites sold, 96
2020 at 12:00am uah wieda, 96
2019 at 04:00pm uah wieda, 95
i would prefer not to, 94
only a sith deals in, 94
it 's the economy stupid, 94
i do n't even know, 94
amnesia a machine for pigs, 94
i know what you did, 94
price eur39.99 ship price 0.00, 94
a league of their own, 94
best part on listen here, 94
phone zoom lens kit camera, 93
let 's go somewhere quieter., 93
gebbt meh grad hann ma, 93
2019 at 12:00am uah wieda, 92
crash bandicoot n. sane trilogy, 92
never gonna give you up, 92
2021 at 04:00pm uah wieda, 92
2022 at 12:01pm uah wieda, 92
talk like a pirate day, 91
sex drugs & rock'n roll, 91
i have a crush on, 91
200g item number 15108 vendor, 91
2019 at 01:00pm uah wieda, 90
omg i 'm so sorry, 90
fly me to the moon, 90
king i have a dream, 90
a hard day 's night, 90
as a matter of fact, 90
a groovy kind of love, 90
2021 at 12:59am uah wieda, 90
2021 at 09:59pm uah wieda, 90
court corrupt fraudulent illegitimate unconstitutional, 90
let 's agree to disagree, 89
2022 at 08:00pm uah wieda, 89
2022 at 08:59pm uah wieda, 89
everything everywhere all at once, 89
a story about my uncle, 88
how far i 'll go, 88
news noticias bitcoin cryptocurrency forex, 88
living in a ghost town, 88
hpa trend 0.7hpa hr rel, 88
wifi bt $ 79.20 click, 88
i know for a fact, 87
all the things she said, 87
it 's a small world, 87
i do my very best, 87
a tale of two sisters, 87
2021 at 11:00pm uah wieda, 87
wrote a new post thread, 86
in a l l e, 86
be a part of the, 86
article number phone > -, 86
2019 at 02:00pm uah wieda, 85
i 'm at munich central, 85
galaxy tab a 10.1 2019, 85
i miss you so much, 85
catch me if you can, 85
i just registered for smash, 85
2021 at 05:59pm uah wieda, 85
2021 at 07:01pm uah wieda, 85
2021 at 12:59pm uah wieda, 85
2022 at 10:01pm uah wieda, 85
i 'm at power play, 84
let 's talk about sex, 84
you 've got a friend, 84
2020 at 08:00am uah wieda, 84
2022 at 10:59am uah wieda, 84
2022 at 12:00am uah wieda, 84
your body is a wonderland, 83
kush kush kush kush kush, 83
3 of 5 stars to, 83
> more quizzes on fb, 83
anti backfree sistem renewal full, 83
a beautiful rendition of s, 83
how much is the fish, 82
i get what you mean, 82
bomber harris do it again, 82
lrdr pop rock dance decouvertes, 82
best i can do is, 82
rollout merchandiser m w n, 82
here 's mine :> happy, 82
order dm or wa fastrep, 82
bold of u to assume, 81
a blast from the past, 81
the power of the dog, 81
the sons and daughters of, 81
and others living with a, 81
another one bites the dust, 81
sw item number 15108 vendor, 81
2022 at 10:59pm uah wieda, 81
u nigel maugham sherry more, 81
do n't shoot the messenger, 80
i should be so lucky, 80
together for a better internet, 80
do n't drink and drive, 80
price eur4.95 ship price 0.00, 80
hpa trend 0.8hpa hr rel, 80
2021 at 11:59am uah wieda, 80
2021 at 09:00pm uah wieda, 80
hobart cook e sampson smollett, 80
leaving on a jet plane, 79
i 'm at senator lounge, 79
istick pico tc 75 watt, 79
i 'm sorry for you, 79
i 'm a barbie girl, 79
kiss a frog online dating, 79
of the artist 's sister, 79
swiss radio choir i barocchisti, 79
the hammer and the dance, 79
black neon radio wonderful life, 79
on podbean check it out, 79
nine 's instagram naninenai nine, 79
wetv vsco youtube apple music, 79
km. for more information visit, 78
today is a good day, 78
watergate & team link eventrestaurant, 78
how i meet your mother, 78
and i think it 's, 78
ad pepper media international n.v., 78
drinking a graminger kirta by, 78
black neon radio funkytown radioshow, 78
2021 at 10:00am uah wieda, 78
2019 at 06:00am uah wieda, 77
am i the only one, 77
are you interested in worn, 77
williams field high school az, 77
2021 at 11:59pm uah wieda, 77
2021 at 06:00am uah wieda, 77
2021 at 04:00am uah wieda, 77
2021 at 01:59pm uah wieda, 77
2021 at 03:01am uah wieda, 77
it 's a real phone, 77
pearce i do n't care, 77
fined 50,000 euros ahead of, 77
cd player $ 74.91 click, 77
i love him so much, 76
uhs-i class 10 microsdhc card, 76
2020 at 01:00pm uah wieda, 76
hi i am live now, 76
stock changed from unknown to, 76
2021 at 11:01am uah wieda, 76
2022 at 10:01am uah wieda, 76
2022 at 01:59am uah wieda, 76
2022 at 03:02pm uah wieda, 76
agents contact me on whatsapp, 76
at erat posuere posuere #, 76
is the order a rabbit, 75
the times they are a-changing, 75
should you post this too, 75
novelist on a state under, 75
2020 at 06:00am uah wieda, 75
lobi junior jaaaaaa das wars, 75
please contact me on whatsapp, 75
star wars the clone wars, 74
i 'm at h stresemannallee, 74
2019 at 07:00am uah wieda, 74
my home is my castle, 74
what goes around comes around, 74
devil in a new dress, 74
as make your vote here, 74
i see this as an, 74
ups i did it again, 74
is a piss drinking slut, 74
way to the top event, 74
service done for you male, 74
2021 at 01:59am uah wieda, 74
instagram e facebook orkut wattpad, 74
a for $ 1619 link, 74
2022 at 05:00pm uah wieda, 74
wifi bt $ 89.99 click, 74
aspire pockex pocket starter kit, 73
such a beautiful photo great, 73
take it or leave it, 73
i know how you feel, 73
apocalipse team google tinder iphone, 73
o deus de espinoza e, 73
2022 at 03:00am uah wieda, 73
2022 at 05:59pm uah wieda, 73
tracy cook e xanthe davy, 73
o'neil elvis habakkuk # #, 73
commons ward habakkuk # #, 73
it 's your turn now, 72
the witcher 3 wild hunt, 72
2020 at 01:01pm uah wieda, 72
black neon radio ring of, 72
2021 at 09:01am uah wieda, 72
a far l'amore comincia tu, 72
berkeley regan watt # #, 72
a night at the opera, 71
keep up the good work, 71
will smith in i am, 71
i feel this so much, 71
i prefer not to speak, 71
aspiratif dan edukatif facebook himago, 71
3.3 phone phone email alexbperry71.com, 71
release of a financial report, 71
d-kedx diamond hk 36tts super, 71
peg # u bob margery, 71
everything happens for a reason, 70
that 's what i said, 70
i hate it so much, 70
concept e 450 digital 5.1-set, 70
black neon radio call me, 70
& let 's talk about, 70
this is not a game, 70
at mauris eleifend lobortis #, 70
i 'm at steigenberger hotel, 69
we love to entertain you, 69
i 've been looking for, 69
i 'm here for it, 69
breath of the wild 2, 69
marketing manager m w d, 69
peters 1083 i like you, 69
2022 at 04:01am uah wieda, 69
wifi bt $ 84.29 click, 69
vpn # ed ackerman n, 69
the truthful lady daughter of, 69
jersey rock in a form, 68
3-farbig item number 15108 vendor, 68
black neon radio geef me, 68
horn 4091 i like you, 68
reply and i 'll say, 68
u.s. senate stop drone attacks, 68
give that wolf a banana, 68
a for $ 1639 link, 68
tophits i 'm a mess, 68
the fu # # #, 68
hewitt no 20 in a, 67
the magic flute papagena papagena, 67
do n't worry be happy, 67
men in black international stream, 67
20 inch atp gemballa velgen, 67
the other side of the, 67
rt if u are hard, 67
black neon radio hands up, 67
black neon radio had je, 67
cat and black cat after, 67
how to become a tyrant, 67
feat glasperlenspiel lichterkettenstadt radio teddy, 67
oh no i 'm sorry, 66
i just liked this song, 66
50 years woodstock the exhibition, 66
2020 at 07:01am uah wieda, 66
here is your unroll 1, 66
good 4 u radio teddy, 66
only murders in the building, 66
crankbait somolovac 50 sr rattling, 65
just to name a few, 65
i 'm at mcdonald 's, 65
if i were a boy, 65
my first impression of you, 65
the end of the world, 65
thailand thailand report 2 2019, 65
co2 emission 0 g km, 65
black neon radio jij en, 65
black neon radio mijn schat, 65
black neon radio bij ons, 65
thanks for the nice mention, 65
2021 at 03:01pm uah wieda, 65
2021 at 07:59am uah wieda, 65
cuba 's covid vaccine rivals, 65
a for $ 1699 link, 65
baby make me wet please, 65
check out my latest article, 64
not in a good way, 64
i 've got the power, 64
fear and loathing in las, 64
o brother where art thou, 64
i 'm like a bird, 64
i love u so much, 64
do n't feed the trolls, 64
tones and i dance monkey, 64
i just made another update, 64
come and lurk a bit, 64
black neon radio hey sue, 64
black neon radio anything goes, 64
black neon radio black planet, 64
black neon radio confidentially yours, 64
doc power & mr. cool, 64
all i know so far, 64
g0 live stream 2022 floyd, 64
that 's what i call, 63
i swear to fucking god, 63
si item number 15108 vendor, 63
check em out yall rt, 63
i am once again asking, 63
peters 3016 i like you, 63
2022 at 07:01am uah wieda, 63
wifi bt $ 68.88 click, 63
zebulon middleton carey pulitzer renee, 63
a new star is born, 62
n't built in a day, 62
with a grain of salt, 62
owner of a lonely heart, 62
i mean look at her, 62
in a & o hotel, 62
in animal crossing new horizons, 62
black neon radio tomorrow started, 62
black neon radio school days, 62
follow thanks for following me, 62
560-480 bc do not believe, 62
the pandemic is a global, 62
2022 at 08:59am uah wieda, 62
and zip code click below, 62
today was a good day, 61
when i was your man, 61
pretty fly for a wifi, 61
in germany we call it, 61
i 'm so so sorry, 61
mansion for a record $, 61
black neon radio for america, 61
atleti liverpool 90 % 25, 61
mom i failed my exam, 61
dimash the story of one, 61
was a deranged disaster as, 61
bernice mill hulda ackerman n, 61
walpole wendy browne # gilbert, 61
enoch halifax burnell alsop p, 61
don't die before i do, 60
i think the fuck not, 60
total eclipse of the heart, 60
i do n't fucking know, 60
and that 's a fact, 60
i feel you same here, 60
what a time to be, 60
i dont make the rules, 60
radio teddy-team lichterkettenstadt radio teddy, 60
live q & a session, 60
i 'm at red bull, 59
i 'm not even mad, 59
i 'm a simple girl, 59
i got 99 problems but, 59
the jump anthem radio edit, 59
she is a techno queen, 59
here 's a pic from, 59
i sing you an embrace, 59
10291 queer eye das loft, 59
a for $ 1049 link, 59
2022 at 11:00pm uah wieda, 59
live stream liverpool vs rangers, 59
insstherehstgtoy points in the rticle, 59
nooneisillegal wrote a new post, 58
i really do n't care, 58
i never promised you a, 58
have a break have a, 58
guns n roses november rain, 58
gift that keeps on giving, 58
i 'm not a robot, 58
devil is a part timer, 58
same procedure as last year, 58
why am i not surprised, 58
black neon radio postcard view, 58
black neon radio gimme hope, 58
hpa trend 0.9hpa hr rel, 58
lehar the merry widow act, 58
go spoofer with joystick gps, 58
account manager m w d, 57
i write sins not tragedies, 57
hello darkness my old friend, 57
star wars a new hope, 57
all i want is you, 57
a win is a win, 57
now i 'm in it, 57
lead developer technical exper berlin, 57
taken & filled by neighbour, 57
kakk order by dm wa, 57
srilanka army manohara n spion., 57
five jobs i had 1, 56
marvel 's agents of s.h.i.e.l.d, 56
earn money with your facebook, 56
never catch a falling knife, 56
consulting wohnbereichsleitung m w i, 56
i 'm not even kidding, 56
i love her so much, 56
a room with a view, 56
aff mim zylinda sigsd as, 56
cost of a data breach, 56
n't you buy me a, 56
product owner m w d, 56
sets a record at the, 56
baby can i hold you, 56
please i ca n't breathe, 56
have a nice evening ps, 56
2021 at 04:59am uah wieda, 56
your life is a joke, 56
hill glenn poe alston hume, 56
i 'm at world sound, 55
i can see clearly now, 55
a long way to go, 55
in the middle of nowhere, 55
i 'm at minty lounge, 55
once in a blue moon, 55
so all you can drink, 55
i 'm now streaming on, 55
has been published on news204, 55
no imperio do brazil classic, 55
no more i 'm easy, 55
alter.nation a dozen bestofs 18-01, 55
wildlife photographer of the year, 55
soul of a dj badhousemusic, 55
story of seasons pioneers of, 55
s.cientists & i.ntellectuals f.or f.uture, 55
famplan anti bf 2 bln, 55
2022 at 04:59pm uah wieda, 55
2022 at 07:59pm uah wieda, 55
2022 at 09:59am uah wieda, 55
fake this is a fake, 55
bvls tre cdwm zziz,u.1589 baird, 55
i do n't know you, 54
in germany we dont say, 54
killing zombies and kissing you, 54
notturnos for piano s. 541, 54
one world together at home, 54
f.i.s.t forged in shadow torch, 54
is a child killer stop, 54
mi is now listening to, 54
a rush of light at, 54
18:00:00 find out more at, 54
2022 at 07:00pm uah wieda, 54
2022 at 06:01am uah wieda, 54
dance i do n't care, 54
pjlbm8hoj3 liverpool vs rangershttps t.co, 54
freda eisenhower abner burns fanny, 54
i wanna be the guy, 53
but i 'm a cheerleader, 53
i 'm in love with, 53
i do n't care about, 53
i knew you were trouble, 53
that 's what i mean, 53
n router vdsl adsl 4x4, 53
another brick in the wall, 53
massage body to body massage, 53
o are you guys using, 53
id 463 in middelhagen-alt reddevitz, 53
i 'm a simple woman, 53
u nebula b sneakers low, 53
dark in the mix mod, 53
phone > 8180 27 bic, 53
2022 at 09:59pm uah wieda, 53
2022 at 01:00am uah wieda, 53
2022 at 06:01pm uah wieda, 53
tophits leave a light on, 53
i 'm here for you, 52
do n't get me started, 52
i mean look at it, 52
i will love you monday, 52
i love to entertain you, 52
i love them so much, 52
i wanna be your girlfriend, 52
i do n't wanna dance, 52
and have a nice day, 52
how to create a demon, 52
new fortnite chapter 2 guide, 52
trust me i 'm a, 52
line number 28 backtrace file, 52
cryptocurrency is not a crime, 52
corry feat mabel i wish, 52
2022 at 01:59pm uah wieda, 52
bni order dm or wa, 52
siniii order by dm wa, 52
