nihr cambridge biomedical research centre, 10
10:00:00 find out more at, 10
in the a shijima story, 10
is hiring a sales manager, 10
horizon forbidden west ps5 gameplay, 10
1x offlabel 2020 u 2x, 10
successful week 2 u all, 10
i will join lootboy because, 10
pitch servo p n 1c508-1-264p, 10
do n't blame people will, 10
2022 at 04:03pm uah wieda, 10
synxt on tlgrm official 108, 10
redbull i love you bro, 10
for a climate of peace, 10
food systems outlook 2022 with, 10
vidio premier sharing 1 bulan, 10
polaris ranger xp900 1000d diesel, 10
fight night gbsports-boxing & entertainment, 10
see more here eng subs, 10
kekzugzug bought g.i toadz for, 10
embedded iot m w d, 10
a clash of two systems, 10
league live football live today, 10
live stream free link 1, 10
and quest will be the, 10
apps for further coding exploring, 10
the code of capital u.a, 10
my favorite city in norway, 10
wifi bt $ 74.67 click, 10
on a permanent deal from, 10
malone stepanie sennef kary mullis, 10
in jeans dance and strip, 10
war is a racket german, 10
findom femdom blackmail cashandgo elitefindom, 10
customer experience awards & summit, 10
i wish you happiness german-english, 10
a german language short comedy, 10
placa-mae for intel xeon e5-1650, 10
wifi bt $ 64.40 click, 10
glacial wilderness in western norway, 10
tourist brochure futurism vintage 1937, 10
d-acvg airbus a330 343e p2f, 10
apps remote m w d, 10
heart health happinesss video an, 10
adaaaaa order by dm wa, 10
the daily telegraph the guardian, 10
used brake master cylinder fits, 10
ridiii order by dm wa, 10
save the date am 22.10, 10
i identify as a millionaire, 10
poem for a nuclear romance, 10
grandpa 's drag-u-la vs the, 10
of figure skating skate america, 10
or group category at the, 10
cd player $ 78.85 click, 10
phone 6 5g gaming phone, 10
analyst m w d remote, 10
fast track order by wa, 10
cup 2022 2023 i 1, 10
ocln opens equity line with, 10
novia johnston e marjorie veblen, 10
a link between worlds #, 10
commons # alger ackerman n, 10
5g smartphone snapdragon 8 gen, 10
sharing 2u 3 bln 5ok, 10
the sweet taste of christmas, 10
jazzalbum a 's of jazz, 10
party by nam and jj, 10
garansi whatsapp 6k 10k order, 10
the sassenach blended scotch whisky, 10
desktop embedded home kitchen einbrenner-gasherd, 10
digital bill of rights video, 10
auntie he called her auntie, 10
lesley morrison michaelia ackerman n, 10
autism. a world of opportuities, 10
i am looking forward to, 9
let 's play madden nfl, 9
2019 at 11:01am uah wieda, 9
dear queridos et chers elerins, 9
admin wrote a new post, 9
i am voting for bts, 9
i really do n't mind, 9
skye egan in a thong, 9
thank you for having me, 9
a star is born lady, 9
let 's call it a, 9
could be a blockbuster battle, 9
2 facts about me 1, 9
skeleton knight in another world, 9
man united live on youtube, 9
'll keep it in mind, 9
g4s secure solutions ag location, 9
glitzerkatapult wrote a new post, 9
sap consultant m w d, 9
microsoft dynamics 365 business central, 9
2019 at 06:01pm uah wieda, 9
this is how i feel, 9
pa wrote a new post, 9
a field guide to getting, 9
shirley holmes + blind butcher, 9
i 'm going to die, 9
e start hu6 19 motor, 9
area bombing directive general directive, 9
no tears left to cry, 9
i know what i like, 9
action-adventure a plague tale innocence, 9
have a nice day too, 9
fruit vinegar sheet mask pomegranate, 9
fruit vinegar sheet mask lemon, 9
orienteering map from german o-federation, 9
bro i do n't know, 9
formula 1 drive to survive, 9
factory in a box 2.0, 9
a smile on my face, 9
a star is born 2018, 9
i want to be a, 9
if beale street could talk, 9
sold another clip teeny girl, 9
live q & a with, 9
i 'm at terminal a, 9
a link between worlds run, 9
< phone more jobs by, 9
just me myself and i, 9
promo code =====> peu6q0 <=====, 9
best of r wasletztepreis 2018, 9
look like an be a, 9
great place to work in, 9
iron maiden guns n roses, 9
no limit feat. a $, 9
a wellness break in zanzibar, 9
i 'm ready to fight, 9
how to train your dragon, 9
for traverso and recorder traverso, 9
sales manager w m d, 9
i 'm at woox lounge, 9
drugs you should try it, 9
50 itunes card itunes card, 9
r beauty professional pw promotion, 9
every 1 's a winner, 9
i am a little bit, 9
4k smart tv led tv, 9
actor in a leading role, 9
drinking a perlenbacher export by, 9
a star is born soundtrack, 9
stroll in an october park, 9
i do n't like them, 9
i 'm sorry about that, 9
workplace as a service waas, 9
just sold a teeny girl, 9
never is a long time, 9
harris on being a stepmom, 9
live in new york city, 9
i 'm a nice guy, 9
it 's not a game, 9
rail & fly u transfer, 9
have a look at this, 9
have a nice saturday evening, 9
in a valley of violence, 9
do i look like a, 9
oooops i did it again, 9
was a friend of mine, 9
i dont care about cookies', 9
sign it and share it, 9
i do n't understand this, 9
all i 'm gonna say, 9
tesla model s 3 x, 9
rt if u like it, 9
unlocked smartphone grade a +, 9
also i do n't care, 9
a wise woman once said, 9
but at least i tried, 9
i scream for ice cream, 9
supply chain m w d, 9
have a nice day 3, 9
go home you 're drunk, 9
bad news are good news, 9
i want a new drug, 9
i 'm at db museum, 9
take a lk social media, 9
isd art 9 ii e, 9
its time for a change, 9
do n't mess with the, 9
workers & resources soviet republic, 9
u know who u are, 9
mi in ruah i dats, 9
say yes to the dress, 9
i 'm at ibis styles, 9
up 's and down 's, 9
drinking a punk ipa by, 9
we are looking for a, 9
by old german beer hall, 9
it took me a while, 9
in a op 16 by, 9
mom i like to fuck, 9
managed care e.v bmc e.v., 9
is that still a thing, 9
wish you a nice day, 9
piano solo version with score, 9
handles this will be a, 9
queen a night at the, 9
i 'm so fucking tired, 9
it 's not a competition, 9
i sing the body electric, 9
i 'm at passport control, 9
decisions and heterogeneity in groups, 9
a l l e s, 9
seminar tom clancy 's the, 9
i mean good for them, 9
modern warfare support me w, 9
i love you very much, 9
i cannot hide my anger, 9
german politics in a nutshell, 9
i do n't belong here, 9
i am mother trailer german, 9
i 'm at cruise center, 9
+ breaking news + +, 9
now to something completely different, 9
'll never break your heart, 9
99 variations on a proof, 9
type beat unread purchase link, 9
xd i do n't know, 9
a few acres of snow, 9
smart led tv-aussteller eek a, 9
no doubt just a girl, 9
item number 108320 vendor touridat, 9
i love new york logo, 9
a german tiger tank of, 9
a nice cup of tea, 9
i do n't care acoustic, 9
let 's play world of, 9
i go with the flow, 9
life is a rollercoaster just, 9
all rights reserved created by, 9
the truth is out there, 9
just pinned to sexo fashion, 9
i 'm at mountain golf, 9
kimetsu no yaiba demon slayer, 9
sex & rock n roll, 9
is this the way to, 9
item number 112215 vendor touridat, 9
drinking a toom belohnbier by, 9
i 'm at crossfit ktb, 9
'll keep that in mind, 9
drinking a grevensteiner ur-radler by, 9
but i have to say, 9
fuck this i 'm out, 9
drinking a robustus 6 by, 9
i 'm done for today, 9
i 'm fun at parties, 9
here i am to worship, 9
i want you to panic., 9
i do n't need that, 9
tenexa model melena a artist, 9
your next connection is a, 9
512gb ssd nvidia geforce rtx, 9
of code a book about, 9
trust me i 'm lying, 9
tenshi no these a cruel, 9
i 'm so ready for, 9
failure is not an option, 9
it 's just a phase, 9
drinking a bio-pils 2.0 by, 9
when the sun goes down, 9
well i do n't care, 9
also shut the fuck up, 9
darwins survival of the fittest, 9
void wrote a new post, 9
us market | top gainers, 9
's live in day 21, 9
get a room you two, 9
cant help falling in love, 9
i'm not crying you are, 9
just a normal day in, 9
2 wins in a row, 9
item number 114174 vendor touridat, 9
i hate to be that, 9
at angelicakate5 a soldier's oath, 9
never chance a winning team, 9
focus for nikon dslr cameras, 9
not to be a bitch, 9
an the one and only, 9
i mean i 'm sorry, 9
i want to go back, 9
this is how i disappear, 9
calling a spade a spade, 9
first pride was a riot, 9
built a temporary residential complex, 9
shaped as a virgin by, 9
a list of papers videobert, 9
youngblood if only i could, 9
higurashi no naku koro ni, 9
come to think of it, 9
i 'm at cineworld-cineplex mainfrankenpark, 9
blunt once upon a mind, 9
lowest ask $ 14950 a, 9
senior consultant d m w, 9
please help a girl out, 9
block market near by hauz, 9
universities allied for essential medicines, 9
i do n't care tbh, 9
release date october 29 1999, 9
investment banking m & a, 9
i 'm at h +, 9
we have a situation here, 9
of a forgotten generation ->, 9
a certain magical index new, 9
price eur33.90 ship price 4.90, 9
i love you colonel sanders, 9
gcm unit under a starlit, 9
excuse me what the fuck, 9
i can be your hero, 9
means a lot to me, 9
ltd te 1000e tfm blknb, 9
actually i do n't care, 9
61cm item number 15108 vendor, 9
7225-250 item number 15108 vendor, 9
thinking out of the box, 9
dirty deeds done dirt cheap, 9
a doubt to face liverpool, 9
study of a horse ii., 9
price eur31.38 ship price 5.00, 9
online players held a torchlit, 9
how to be a woman, 9
the ride of a lifetime, 9
l99.2 item number phone vendor, 9
price eur36.64 ship price 5.00, 9
maybe i am dreaming by, 9
price eur24.83 ship price 5.00, 9
91717 item number 15108 vendor, 9
bendy and the ink machine, 9
iheuwa buys a new car, 9
scholarship of teaching and learning, 9
10-305nf item number 15108 vendor, 9
2x300w item number 15108 vendor, 9
i do n't like him, 9
that 's the whole point, 9
the future soho house berlin, 9
come on get a life, 9
price eur47.99 ship price 4.99, 9
there is no climate emergency, 9
in dynamics 365 business central, 9
and i 'm not ready, 9
price eur37.20 ship price 4.90, 9
central park in new york, 9
price eur19.76 ship price 5.00, 9
hp color laserjet cm 2300, 9
i give you my heart, 9
download saunders nursing drug handbook, 9
the last of us ii, 9
price eur54.35 ship price 4.99, 9
killer in dead by daylight, 9
deluxe-album item number phone vendor, 9
i 'm not a fan, 9
e one country two continent, 9
ps i still love you, 9
price eur22.67 ship price 5.00, 9
you 're watching a movie, 9
it 's been a blast, 9
a place to call home, 9
i just published prediksi bola, 9
+ 49 0 221 792, 9
i do n't give fuck, 9
2942 item number 30322942-2 vendor, 9
i will call you later, 9
doctors for choice germany e.v, 9
a child of our time, 9
n3 luxembourg france tescht n56, 9
price eur17.98 ship price 5.00, 9
phone item number 1104190000030-104 vendor, 9
hack // g.u last recode, 9
4504 item number phone vendor, 9
of a lady in fire, 9
sword art online war of, 9
price eur84.95 ship price 3.95, 9
33153-004 item number phone vendor, 9
thank u so so much, 9
3 days in a row, 9
i volunteer as a tribute, 9
a calm & quiet place, 9
i am a strange loop, 9
b3.9136 item number 305b39136-10 vendor, 9
i 'm at kuckei +, 9
045902 item number 139045902-00 vendor, 9
2030-05 item number 152203005-2 vendor, 9
i cant stop loving you, 9
4505 item number phone vendor, 9
48782 item number 48782-42 vendor, 9
wish you all the best, 9
12920 item number 21012920-069 vendor, 9
price eur24.97 ship price 5.00, 9
i 'm ready for the, 9
49538 item number phone vendor, 9
i believe my pig whistles, 9
price eur199.95 ship price 3.95, 9
it 's just a fact, 9
price eur21.95 ship price 3.95, 9
2975 item number phone vendor, 9
a closer look at the, 9
i 've seen the light, 9
the many saints of newark, 9
do n't be a stranger, 9
21.11.1992 killed by fascist in, 9
70164 item number 21170164-1 vendor, 9
vonnegut museum opens in indianapolis, 9
it 's a mixed bag, 9
a lone home and horny, 9
stepsisters have sex with stepbrother, 9
960nd item number 119c000960ndx0045-c1501 vendor, 9
70816 item number 21170816-1 vendor, 9
an item number 185an-3014 vendor, 9
a10079 item number 333a10079-neutr vendor, 9
1743 item number phone vendor, 9
new post amazon music unlimited, 9
h item number phone vendor, 9
strategic command world war i, 9
mobility as a service alliance, 9
felton item number 227felton-0001 vendor, 9
u.s. department of homeland security, 9
all i have to say, 9
i think i 'll pass, 9
isd art 6 i c, 9
1913m item number 1531913m-25 vendor, 9
clarkson since u been gone, 9
90335 item number phone vendor, 9
not to be a boomer, 9
5757 item number phone vendor, 9
have a nice day everyone, 9
the picture of dorian gray, 9
if i should fall from, 9
1717 item number 2391-25 vendor, 9
3962-48 item number 118396248-130 vendor, 9
price eur79.95 ship price 3.95, 9
a bit of a stretch, 9
literally a l l e, 9
cd-rom item number phone vendor, 9
allowfullscreen iframe p a href, 9
shingeki no kyojin attack on, 9
end of the fucking world, 9
as we say in german, 9
love is only a feeling, 9
62764 item number phone vendor, 9
228-702 item number 118228702-29 vendor, 9
2359 item number phone vendor, 9
1107 item number phone vendor, 9
and i do n't know, 9
326 item number 172-25 vendor, 9
i do n't have any, 9
9539 item number phone vendor, 9
i present to you the, 9
we wish you a wonderful, 9
out of tomorrow 's game, 9
peace and security studies m.a., 9
a broken heart for christmas, 9
my life is a gunshot, 9
i wish you a nice, 9
keep a stiff upper lip, 9
i am a sucker for, 9
the people vs o.j simpson, 9
12960 item number 119c012960ndx0001-c0501 vendor, 9
i can dream about you, 9
ok i see your point, 9
all i want 4 christmas, 9
109641 item number 191109641-7256 vendor, 9
i cant do this today, 9
a day in a life, 9
5497 item number phone vendor, 9
price eur21.00 ship price 4.90, 9
i do n't feel good, 9
galaxy tab a sm-t280n 8gb, 9
how to raise a feminist, 9
nuthin but a g thang, 9
matchbox n y-9 mint box, 9
go for it i guess, 9
university college of health sciences, 9
its just a prank bruh, 9
sgd-kurse has been published on, 9
i just do n't get, 9
germans thought the same about, 9
a symphony of horror nosferatu, 9
i miss the old kanye, 9
doctors for choice germany e.v., 9
comment a number check your, 9
7227-600 item number 15108 vendor, 9
cta chemielaboranten f m d, 9
6400 item number 119c006400ndx0292-c1501 vendor, 9
i 'm at in holdorf, 9
and incredibly risky escalation with, 9
mini pc intel j3455 6gb, 9
hate it or love it, 9
79766 item number phone vendor, 9
i really do n't understand, 9
life in a northern town, 9
expeditors is looking for an, 9
confessions on a dance floor, 9
highway to the danger zone, 9
i do n't know either, 9
to pink world seul 1, 9
underwater photographer of the year, 9
hello my love guys sorry, 9
adidas predator 20.3 fg j, 9
i was born in the, 9
i just call to say, 9
i am not okay with, 9
community & social media manager, 9
original title me and mcgee, 9
study for a cultural complex, 9
i do n't like mondays', 9
i am the queen of, 9
darkwing duck chip & chap, 9
dv isd art 2 i, 9
online newtop story coronavirus news, 9
dark souls 3 cinders mod, 9
a-channel the animation vol.1-12 end, 9
all the birds in the, 9
what is a blow job, 9
let 's talk about class, 9
smiling face with heart-shaped eyes, 9
i do everything for you, 9
like a house on fire, 9
follow me i follow back, 9
this is a friendly reminder, 9
international best music search worldwide, 9
i spit in your grave, 9
never catch a falling knive, 9
ice switch mein'n drip everyday, 9
at e & k automation, 9
every day i wake up, 9
the road to a vaccine, 9
k1 ang $ t for, 9
the future 's so bright, 9
udimm desktop memory upgrade module, 9
slater by ostgut ton a-ton, 9
germany register to start here, 9
% done with vicious das, 9
i love you now change, 9
i will win this raffle, 9
i dont get the point, 9
i wanna go back to, 9
two wrongs make a right, 9
two truths and a lie, 9
you get what you deserve, 9
you have a point there, 9
correct me if im wrong, 9
i 'm a savage classy, 9
everybody gets a second chance, 9
no peace fight the police, 9
i 'm so sick of, 9
official the 2015 live recordings, 9
's i am the man, 9
official the 2005 live recordings, 9
can you feel my heart, 9
i 'm no longer here, 9
black neon radio our time, 9
museums facing a planetary emergency, 9
i 'm here for the, 9
do n't fight the fed, 9
u.s. fish and wildlife service, 9
i 'm a slut for, 9
rocking all over the world, 9
the elder 3 october 1722, 9
fit for the time after, 9
official video aggressive punk prod, 9
good gaming well played democracy, 9
as a potential replacement for, 9
well to tank-tank to wheel, 9
rt if you like it, 9
fio gamer hyperx pulsefire dart, 9
vw caddy 50 km h, 9
black neon radio so what, 9
i knew i loved you, 9
i 'm a loser baby, 9
nobody knows i 'm here, 9
i bath-robe ko-tex standard 100, 9
there is glory in prevention, 9
superspreading-events do n't be a, 9
now on naija reports official, 9
the bar is so low, 9
comeback player of the year, 9
sending you a big hug, 9
do n't miss any news, 9
17 inch artec cup velgen, 9
that 's life i guess, 9
cancel culture at its best, 9
slogan make america great again, 9
man lion 's city e, 9
marry me i love you, 9
i see no problem here, 9
well i 'll be damned, 9
microsoft windows server 2019 standard, 9
scale 1:18 by check out, 9
2020 at 10:01am uah wieda, 9
google play c album deluxe, 9
i do n't wanna fight, 9
5 games i played 1, 9
gt sport daily race b, 9
'll give it a shot, 9
o barber quarter g us, 9
toxic masculinity in a nutshell, 9
sex and rock n roll, 9
the trial of the chicago, 9
your pokedex detects s spirit, 9
app developer m w d, 9
wtf i 'm so sorry, 9
rules for being a girl, 9
digital branding & customer experience, 9
i mean i can try, 9
i 'm glad you asked, 9
ks keys as a service, 9
by the way i 'm, 9
night of the dead gameplay, 9
master of science in epidemiology, 9
again and again and again, 9
what if we kissed at, 9
mixcloud electro house trending chart, 9
as ross an hupf'rer to, 9
vote make a wish end, 9
no f j 223 +, 9
erzurum international airport erzurum turkey, 9
enter to win this competition, 9
one + series s x, 9
ruined king a league of, 9
i dont get it either, 9
it security made in germany, 9
gaming b460m-plus chipset b460 intel, 9
item number 18387810h232 vendor spartoo, 9
prevents soap build-up lime shampoo, 9
squir.rel no pic no chance, 9
berlin wild life 24h cream, 9
data centers edges of a, 9
in a desert with his, 9
attends slip active 10 large, 9
undefined 6.9 grad c undefined, 9
heal m + 5,7k resto, 9
findom finsub walletdrain humanatm paypig, 9
water cooler deepcool gammaxx l360, 9
show me a pic of, 9
undefined 8.3 grad c undefined, 9
and cheap check for more, 9
is a pivotal project among, 9
i live what i am, 9
a libertarian walks into a, 9
concept e 450 digital 5.1, 9
// merry christmas unsencored link, 9
birds of prey 4k steelbook, 9
give me a child until, 9
undefined 8.4 grad c undefined, 9
city 70 % - 30, 9
girl _ deluxe 31 chat, 9
wv boys 1st half scoring, 9
1-2 beer sheva a. ready, 9
stepmom makes him a man, 9
0.00001 btc = -% 5, 9
tag have a nice friday, 9
rive for woman in woman, 9
top top top top mwgfd, 9
have a nice night sweetheart, 9
stay a live-streams 29. 31.01., 9
we do n't know her, 9
the skyrocketing homeless population of, 9
newsletter e & m weekly, 9
sold another clip advent advent, 9
gunge tank messy model updates, 9
i do not like it, 9
price 29.99 ship price 0.00, 9
apply now senior full-stack developer, 9
as an athlete a thread, 9
lft as a solo for, 9
commits a foul on can, 9
i 'm in a footnote, 9
price 34.99 ship price 0.00, 9
16 premium antirutschpads 50 mm, 9
a movement will defeat amazon, 9
party d d d chat, 9
best all-rounders i vote for, 9
give a voice to asians, 9
msto thought they just sold, 9
findom femdom finsub leatherfetish latinadomme, 9
it 's a progressive match, 9
+ stage pros = 100, 9
& finish arctic white gloss, 9
laptop satellite u 400-15g win, 9
star has died at 29, 9
look that kills live in, 9
time is a flat circle, 9
german sub my hero academia, 9
get it for26.00 us $, 9
queen of _ the highway, 9
i 'm writing you name, 9
paypig socks sockfetish fetish cashandgo, 9
high frequency active auroral research, 9
businessman with extensive agricultural interests, 9
v.e. day times square 1945, 9
for men brave 100 ml, 9
a dance of fire and, 9
sereno fine settimana. carissimi saluti, 9
nominees 2021 q & a, 9
just take a few minutes, 9
thank you for 6.055 follower, 9
nurses a voice to lead, 9
sap cloud maturity model survey, 9
this is a climate emergency, 9
ending today at 18:00 cet, 9
monarchy 6th smallest country o, 9
on s5 ja-050 hom 839m, 9
smallrig mini follow focus 3010, 9
call me if you get, 9
game faces podcast powered by, 9
ebay h0 faller marienschacht &, 9
what the fuck happened to, 9
e-world energy & water 2022, 9
little witch in the woods, 9
2x usb 3.2 4x us, 9
5x usb 3.2 2x usb, 9
by pni prevention network international, 9
fall guys community event do, 9
congratulations you got it right, 9
a global pandemic exit exercise, 9
great wall motor co ltd., 9
2021 at 07:02pm uah wieda, 9
2021 at 07:03am uah wieda, 9
ave fenix1986 added a bet, 9
2021 at 12:04pm uah wieda, 9
mistress miss moneymistress moneyslave moneydom, 9
smart factory & connected cars, 9
we dont need you anymore, 9
e flat av 132 1, 9
i 'm at rezene lounge, 9
drivers in my book 1, 9
& follow to update stream, 9
daughter makenna kamalei yoona west, 9
wagon r + 00 ->, 9
obaidullah ibn ziad in kufa, 9
for string trio listen at, 9
lisa and the blood moon, 9
2nd player 90k doyoung empathy, 9
commits a foul on wolf, 9
a new controversy erupts around, 9
2.6 email collierl.org phone phone, 9
advent 2021 kl hi hi, 9
rapid e-tech 100 % electric, 9
thru dm or wa on, 9
x it 's a boy, 9
3 facts 3 names 1, 9
% off enjoy titles from, 9
spider man no way home, 9
make it a quote bot, 9
the laguiole way of life, 9
comets sign former nfl receiver, 9
wxw wrestling academy live vol., 9
customer service & call center, 9
4 car set very rare, 9
ix flow featuring e ink, 9
shout out to a &, 9
there will be no longer, 9
session finsub assworship ebonygoddess kontofick, 9
a way back to luckyland, 9
43 scale c $ 32.20, 9
fit slim color a size, 9
findom femdom moneydom finsub slave, 9
news a verified account starts, 9
should resign from russian firms, 9
a for $ 1657 link, 9
what am i doing now, 9
eu make america great again, 9
horses & dreams meets canada, 9
eu charter of fundamental rights, 9
2022 at 10:02pm uah wieda, 9
i made a study of, 9
2022 at 09:04am uah wieda, 9
ladygold _ com just sold, 9
never back down free spirit, 9
rhodes & ezekiel vs. usos, 9
gps track wifi 1080p a, 9
galaxy m33 5g android smartphone, 9
life is a human right, 9
a quiet place day one, 9
russians send natiional minorities to, 9
gb ssd silver colour refurbish, 9
android 10.0 car radio for, 9
credit bank phone nagahama yoshitaka, 9
hd live stream aljaz bedene, 9
apple ipad 10,2 9th generation, 9
of a building in the, 9
dragon ball super super hero, 9
4 impulse 12 lightning talks, 9
wetv sharing 1 bulan 10k, 9
uranium energy uec 3.496 %, 9
sport has been published on, 9
electric power systems of u.s., 9
job in germany software developer, 9
top 20 places to visit, 9
switzerland tourist brochure vintage hug, 9
think big flowtex -> wirecard, 9
i wish you happiness german, 9
cast iron cooking grates for, 9
germany tourist brochure vintage 1962, 9
leader in digital twin services, 9
ddps swiss army by a, 9
kinky shows fetish market ticketlink, 9
% off onn 55 class, 9
hm water managment 1362 families, 9
info u14 u2 u34 u4, 9
tophits if i loved you, 9
tophits you make me crazy, 9
sing sing sing dance video, 9
league draw group a arsenal, 9
dance i want your soul, 9
dance you give love a, 9
on sv mc-073 siniatsiko 2107m, 9
live scores fc munich 2, 9
18k order by dm wa, 9
it-sa home of it security, 9
amazon basics ifri usb 2.0, 9
rugby world cup sevens 2022, 9
redeem code famplan 3 bulan, 9
buy it for me here, 9
pope griselda o'casey # #, 9
master duel check it out, 9
a life like any other, 9
b6yta5sgth liverpool vs rangershttps t.co, 9
'll serve your ass like, 9
azle high school email aidenlane1418.com, 9
bertha pope # # #, 9
sampson humphr e y burgess, 9
af fighter pg haj fuc, 9
make your predictions now at, 9
quit like a millionaire 100, 9
donahue cook e burgess macarthur, 9
sandy enoch humphr e y, 9
221125 golden child in brazil, 9
geraldine hicks solomon cook e, 9
# norman bird vicky judson, 9
cook e beverly penn wilbur, 9
aubrey terry coral johnston e, 9
her proposal was n't intended, 9
+ act 35 wechat worldyoyo66, 9
lu mystery # 2 by, 9
opensea + 56941286390https opensea.io 0xd28323f69e3d4f267530a8f86038fe7f8fc11d29ariasliz, 9
5g series 6gb + 128gb, 9
armored core vi fires of, 9
accommodate a number of things, 8
let 's play gameplay german, 8
sold another clip alphapaar vs, 8
ecco soft 7 zip at, 8
i hate that so much, 8
alliance of peoples and nations, 8
you can call me al, 8
tom petty and the heartbreakers, 8
i 'm at grill restaurant, 8
with a fan at at, 8
why should i do this, 8
a bath full of ecstasy, 8
square garden in new york, 8
2019 at 09:01pm uah wieda, 8
u do n't get it, 8
cliff hotel and restaurant switzerland, 8
song what a wonderful world, 8
software as a medical device, 8
there is always a way, 8
the capital a big game, 8
head of a & r, 8
19 inch bbs ch velgen, 8
last in my winds by, 8
it 's gin o clock, 8
before i go to sleep, 8
take a wild fucking guess, 8
2019 at 07:02am uah wieda, 8
music for a new society, 8
what a time to live, 8
as you wish my lady, 8
rt to save a life, 8
that 's how it works, 8
all at studio avalon berlin, 8
and i am not ashamed, 8
i call that a win, 8
let the good times roll, 8
i 'm at h bayrischer, 8
is calling s.o.s. for love, 8
i 'm living the dream, 8
way out of my league, 8
when i 'm sixty four, 8
i 'm at meininger hotel, 8
's fight & sportcenter e.v., 8
box 7430 vdsl adsl2 +, 8
started the rnr nashville half, 8
4 weddings and a funeral, 8
i feel the earth move, 8
this shit i 'm out, 8
n't dance official music video, 8
is a big fan of, 8
i 'm at now in, 8
who are you to judge, 8
akq cancels tornado warning for, 8
like i do n't know, 8
n all you can eat, 8
i 'm at u zoo, 8
my brother from another mother, 8
