2022 at 01:01pm uah wieda, 8
payment all e-wallet bca qris, 8
tiger cica green chill down, 8
foster & the long shadows, 8
silicate of potassium sodium or, 8
cresswell soucek rice fornals bowen, 8
and co time to die, 8
a light for attracting attention, 8
best time to become a, 8
a thread au taekook end, 8
monkeys 2k collectionfloor price 0.019, 8
three thousand years of longing, 8
has a new conspiracy hypocrisy, 8
stake your bags while you, 8
us fracking gas & us, 8
digital futurecongress 2022 am 17.5, 8
sonic x game l.a noire, 8
is not a serious club, 8
queer romance roman regency park, 8
he 's a 10 but, 8
% union 11 % 1, 8
business transformation w m d, 8
+++ update 04.06. 2022 +++, 8
radio networks m w d, 8
gear oil leak rebuild for, 8
the killing of a journalist, 8
vaccination a journal of health, 8
key account manager in international, 8
xbox 360 wireless n network, 8
economics for the common good, 8
xsw-iem wireless in-ear monitor system, 8
oh no q a q, 8
android 10.0 smartphone 7.1 inch, 8
phone cheap cellphones celular iphone, 8
's 4rated ls 23wkurtz.org phone, 8
im directors' club q &, 8
how can i be homophobic, 8
usermod a g dialout foobar, 8
fund carbon neutral 100 etf, 8
im stream \ o start, 8
bass drum o 's bass, 8
shop sections dragon ball x3, 8
report in a nutshell the, 8
consulting 21 years of experience, 8
% off lg 55 class, 8
dance give me a chance, 8
in cult of the lamb, 8
live stream hd live link, 8
a beautifully strange photoillustration of, 8
dance life is a highway, 8
dance i want it all, 8
dance say a little prayer, 8
bundesliga2live streaming online watch now, 8
discovery original sex tape v.i.p., 8
in a pirate 's tale, 8
army chief general qamar sot, 8
dance weekend on a tuesday, 8
kakakk order by dm wa, 8
bisaa order by dm wa, 8
sonic x game fear 1, 8
fremragende gibson es-335 8.000 kr., 8
galaxy m52 5g smartphone global, 8
dance freaking out matoma remix, 8
works as a nurse inswitzerland, 8
national beer lover 's day, 8
10 seconds quicker than before, 8
fave tags five faves food, 8
seller + 3k all ewallet,qris,bank, 8
five facts five faves food, 8
everytime we touch album version, 8
n on p harmaceutical i, 8
airways man-doh manchester airport to, 8
boyce walton gladys jenkin s, 8
hobart johnston e fitch mill, 8
iranian women are making a, 8
shop helper in fashion store, 8
lovevook handbag miss shopper shopper, 8
lynch michell polly freda madge, 8
slight risk of icy surfaces, 8
std fossil premium sales promotion, 8
gale robinson # kitty i, 8
is showing up in pokemongo, 8
i 've just started following, 8
s. naval hospital balboa park, 8
renee fast humphrey ackerman n, 8
watch video of huge polar, 8
e wallet n qris /, 8
stocks options futures discussion groups, 8
klmu online radio christmas oratorio, 8
dunk low retro white black, 8
in call of duty black, 7
do n't tell a weird, 7
talent manager m w d, 7
horses & dreams p.s.i events, 7
i 'm at rheinenergiestadion for, 7
five jobs i ve had, 7
likes help me i need, 7
call it what u want, 7
2019 at 10:01am uah wieda, 7
there is a lot to, 7
i be looking for freedom, 7
i feel you a lot, 7
br90 wrote a new post, 7
meanwhile in a parallel universe, 7
love is like a butterfly, 7
heals a man with leprosy, 7
i 'm at lenard grill, 7
this is hot just sold, 7
leaves a $ 2,000 tip, 7
security innovative trends inno trends, 7
why i am not surprised, 7
i 'm not quite sure, 7
i do n't have money, 7
2019 at 08:01pm uah wieda, 7
i am the king of, 7
2019 at 05:01pm uah wieda, 7
this and ill dm his, 7
odi profanum vulgus et arceo, 7
metropolitan museum in new york, 7
times at the el royale, 7
i want to be your, 7
i 'm at rhine tower, 7
was a german landscape painter, 7
everybody needs somebody to love, 7
would n't it be good, 7
a heart in new york, 7
akzurecht wrote a new post, 7
online marketing seminar im b2b-bereich, 7
about this match see in, 7
paypal u circle pay goldfoilangel.de, 7
set fire to the rain, 7
radio-a wrote a new post, 7
advance mathematics || fast solution, 7
best day of my life, 7
i follow i follow you, 7
drinking a kremlin gremlin by, 7
i 'm so sorry hun, 7
because i do n't care, 7
smart tv eek a +, 7
drinking a baltic dubbel by, 7
fake news & hate speech, 7
vindication of the rights of, 7
i am a very stable, 7
ebay led-tv lg 55 uk6300, 7
bro i swear to god, 7
the one that i want, 7
please support my gofundme campaign, 7
ya know what i mean, 7
ne farm i-ei i-ei ooh, 7
harshad eyes are dangerous af, 7
pauper press book 1959 hb, 7
hub 820 mm 3 870,00, 7
i dont feel so good, 7
mansplaining at it 's best, 7
i think it 's funny, 7
let 's dance show 5, 7
rob spence mad men in, 7
to good to go app, 7
if i were a carpenter, 7
there is no business like, 7
and i think it shows, 7
1 just sold a my, 7
captain america the first avenger, 7
the world in a nutshell, 7
spider man far from home, 7
merian global investors uk limited, 7
i wanna know what love, 7
i 'm at dmix fitness, 7
sold another clip schwanzgeiles hurendoppel, 7
series 2019 4 hours of, 7
ertel automobile u computer phone, 7
no news are good news, 7
i 'm crazy for you, 7
the calm before the storm, 7
she wore a yellow ribbon, 7
cken-alt deluxe massage & more, 7
card software download and install, 7
never nuke a country twice, 7
i do n't see the, 7
i 'm at aloft munich, 7
potter and the cursed child, 7
let 's start a movement, 7
benny wdh mo 20:00 -, 7
online marketing m w d, 7
se non e vero e, 7
check also my new book, 7
ballad of a thin man, 7
how to be a feminist, 7
can i have your number, 7
the beginning of a great, 7
im restaurant bocca di bacco, 7
i hate when that happens, 7
god gave rock'n'roll to you, 7
new insider filing on chairman, 7
imagination just an illusion 1982, 7
item number 109460 vendor touridat, 7
it be like that sometimes, 7
fort = reichw. m. heiz, 7
respect existence or expect resistance, 7
yeah that 's really great, 7
b450m gaming amd am4 matx, 7
squeeze green watery sheet mask, 7
happy birthday to a true, 7
download word of mouth viral, 7
i 've created a monster, 7
it 's a different world, 7
i walk a lonely road, 7
i 'm not your toy, 7
application manager m w d, 7
a little bit of you, 7
a woman of no importance, 7
no such thing as a, 7
stroll in an autumn park, 7
breath of the wild live, 7
driller the girls next door, 7
i am waiting for you, 7
and i 'm not sorry, 7
american soldiers inspect a german, 7
item number 110634 vendor touridat, 7
a song of fire and, 7
item number 110733 vendor touridat, 7
makes the world go round, 7
a place for the unwilling, 7
okay now i get it, 7
# see u later in, 7
i 'm at coffee shop, 7
campbell and the bastard sons, 7
in love with a ghost, 7
item number 114098 vendor touridat, 7
does that ring a bell, 7
's feel i. presage flower, 7
turtles all the way down, 7
you 're holding it wrong, 7
day 2 # # owners, 7
i added a video on, 7
we send a warm w, 7
i wish i could fly, 7
i 'm lucky i 'm, 7
tumalwat wrote a new post, 7
on radio de schans stream, 7
item number 112696 vendor touridat, 7
i 'm tired of this, 7
i owe you my life, 7
tool system of a down, 7
i 'm alive official video, 7
because i do n't know, 7
good,have a look at it, 7
nah i do n't think, 7
that 's a hard one, 7
2 facts 2 lies 1, 7
item number 112720 vendor touridat, 7
i 'm so fucking proud, 7
that 's how it goes, 7
city wolf i + ii, 7
this is how i roll, 7
n't afraid of no ghost, 7
all the best for you, 7
drinking a dulcis 12 by, 7
2nd level m w d, 7
i feel so sorry for, 7
item number 113749 vendor touridat, 7
keep it simple and stupid, 7
and now here i am, 7
professional scrum master psm i, 7
4 o'clock in the morning, 7
how to secure a country, 7
breath of the wild stream, 7
data analyst m w d, 7
the story of my life, 7
o brother where are thou, 7
they see demon i see, 7
lessons of a dream 2011, 7
i will say it again, 7
it 's a boy girl, 7
junior it-systemadministrator m w d, 7
operations manager m w d, 7
wtf is wrong with me, 7
ux360 user experience & expert, 7
i will be your shield, 7
a plague tale innocence live, 7
and i really mean it, 7
item number 109773 vendor touridat, 7
item number 113730 vendor touridat, 7
as a service legal tech, 7
i 'm at ameron hotel, 7
born in the wrong generation, 7
one problem at a time, 7
i like you very much, 7
made a very big mistake, 7
players as dollify a thread, 7
last light lets play part, 7
if i were the devil, 7
head of sales & marketing, 7
freedom of the press foundation, 7
shanties & songs to sea, 7
item number 113596 vendor touridat, 7
liar liar pants on fire, 7
the benefit of a doubt, 7
amazon prime day 2019 giga, 7
black to play and win, 7
item number 109879 vendor touridat, 7
yes we did it again, 7
ring a ring o roses, 7
it 's never too late, 7
i 'm not a crook, 7
only when i lose myself, 7
a small town in the, 7
24h support 24 7 livecams, 7
i can get behind that, 7
clothes dungarees girl in dungarees, 7
apps im google play store, 7
sold another clip spermageile blondinenschlampe, 7
three cheers for sweet revenge, 7
the enemy of the people, 7
i 'm just here for, 7
man with a movie camera, 7
treat first what kills first, 7
item number 109802 vendor touridat, 7
first version powered by 160, 7
engine driving a four-bladed propeller, 7
bi consultant m w d, 7
i do n't want him, 7
okay okay i get it, 7
always change a running system, 7
state of the union union, 7
i 'm not ready for, 7
glorious pc gaming race model, 7
walk like a badass playlist, 7
item number 112934 vendor touridat, 7
lord give me a sign, 7
i aint got no type, 7
partner of the year 2019, 7
here i am back again, 7
i should n't be alive, 7
item number 113814 vendor touridat, 7
im hard rock hotel in, 7
wellness rock spa rock'n roll, 7
check out budo 's finest, 7
ibn ishak u ibn hischam, 7
the blues of the soul, 7
heartbreak on a full moon, 7
item number 113874 vendor touridat, 7
i always wanna die sometimes, 7
the house is on fire, 7
acoustic vehicle alerting system avas, 7
why i am not astonished, 7
on the way to the, 7
nailed judy garland 's iconic, 7
ne no nej non no, 7
every is a disguised dictator, 7
interview at vivatech 2019 with, 7
mad crush strider 's secret, 7
check me if you can, 7
pee with my new high-heels, 7
do n't let a good, 7
it analyst m w d, 7
in the house 20:15 the, 7
original new unlock version oneplus, 7
i 'm at center in, 7
backstage in 1983 photo by, 7
a small town in germany, 7
and i am here like, 7
n't go on without you, 7
graphic design is my passion, 7
it 's a co-founder match, 7
24 hours of insanity at, 7
hold your head up high, 7
i 'm at grassi museum, 7
good for you i guess, 7
now for something completely different, 7
fallout 4 lets play part, 7
by durma ms 2504 phone, 7
an the last of us, 7
bring creativity into your life, 7
a dildo for my pussy, 7
i 'm at zazie bar, 7
i take it all back, 7
i want his fuck cream, 7
feel free to do so, 7
de code de la route, 7
a deal with the devil, 7
i 'm at top sportmarketing, 7
3 bedroom townhouse in club, 7
at beatz official hd video, 7
oh give me a break, 7
do 's and dont 's, 7
landscape with a church by, 7
touch a millipede & other, 7
how to read a book, 7
account manager w m d, 7
symphony n25 kv 183 w, 7
pink just like a pill, 7
special place in my heart, 7
b450-plus gaming chipset b450 amd, 7
have i been pwned hibp, 7
bank is a unique problem, 7
i was owa des wissat, 7
trumps make america great again, 7
diversity meets tech innovation moinworld, 7
why do i even try, 7
you now what i mean, 7
i did not expect that, 7
kid cudi day n nite, 7
5 wins in a row, 7
how to save a live, 7
i want to kill you, 7
in german we would say, 7
i 'm at congress center, 7
system of a down songs, 7
happiness is not a choice, 7
drinking a statement session pale, 7
belief in a just world, 7
i 'm totally in love, 7
all these things i hate, 7
but i am not sure, 7
i 'm so fucking done, 7
unveils new air defense system, 7
a hoe to get him, 7
of the duelist link evolution, 7
timer game blackmail-fantasy & ppp, 7
to the world little boy, 7
farandole of bisexual beings' on, 7
here 's a crazy idea, 7
breath of the wild switch, 7
does n't give a shit, 7
i feel u so hard, 7
150entradas 150posts 2semestres secondary school, 7
are you curious about what, 7
let 's rock n roll, 7
lokomotiv moscow group e liverpool, 7
not to be that guy, 7
timbaland the way i are, 7
plan a b c d, 7
lowest ask $ 59950 a, 7
variation 30 a 1 clav, 7
i 'm bringing sexy back, 7
aaaand we have a winner, 7
the only one i know, 7
i do n't have one, 7
i want to go home, 7
i agree that we disagree, 7
an officer and a spy, 7
one vision of queen feat, 7
> be quiet speedlink runtime, 7
the gardener & the tree, 7
it 's been a hot, 7
i 'm not feeling it, 7
plants vs zombies battle for, 7
bob n is playing die, 7
it 's 5 o'clock somewhere, 7
a shaun the sheep movie, 7
price eur92.34 ship price 4.90, 7
is that even a word, 7
28cm item number 15108 vendor, 7
price eur26.90 ship price 4.95, 7
premium t promodoro fun shirts, 7
dripping so wet like perignon, 7
by space above the sink, 7
too big to fail aber., 7
that 's what i need, 7
get yourself a man who, 7
thats not what i meant, 7
german track cycling championships 2019, 7
living like a star t, 7
hip hop class on stage, 7
price eur19.16 ship price 5.00, 7
3r safety & defense protect, 7
cd-audio item number phone vendor, 7
like they forgot to read, 7
price eur15.09 ship price 5.00, 7
item number 113870 vendor touridat, 7
40g item number 15108 vendor, 7
price eur20.27 ship price 5.00, 7
i am happy to help, 7
climate change greenhouse effect global, 7
only a fool deals in, 7
phone item number 15108 vendor, 7
let 's play retro c64, 7
hp deskjet 3910 hp deskjet, 7
's laugh a thread #, 7
i wish i was a, 7
have you ever been to, 7
item number 10039 vendor touridat, 7
7310-320 item number 15108 vendor, 7
item number 445 vendor touridat, 7
today is a great day, 7
10-303nkh item number 15108 vendor, 7
price eur17.96 ship price 5.00, 7
item number 113768 vendor touridat, 7
7092-000 item number 15108 vendor, 7
i feel the same way, 7
15-band item number 15108 vendor, 7
price eur15.78 ship price 5.00, 7
tf did i just read, 7
zb570tl free kaos dan iring, 7
item number 112776 vendor touridat, 7
seika wobbler nightveit seika wobbler, 7
10-303nfkd item number 15108 vendor, 7
and let me tell you, 7
we are on a mission, 7
item number 112614 vendor touridat, 7
i feel you < 3, 7
last time i checked stand, 7
price eur296.94 ship price 4.99, 7
price eur21.80 ship price 5.00, 7
only the good die young, 7
item number 111244 vendor touridat, 7
price eur15.49 ship price 5.00, 7
take it like a woman, 7
ef a tale of memories, 7
price eur40.79 ship price 5.00, 7
125l item number 15108 vendor, 7
soliom solar wireless video doorbell, 7
7302-320 item number 15108 vendor, 7
or degrading treatment or punishment, 7
bitch 17 schoolgirl knallgelbe long, 7
wounds canada 2019 annual conference, 7
bx swimmer rapala bx swimmer, 7
lovells advised as the issuer, 7
price eur219.00 dress for success, 7
album official photo i am, 7
price eur37.99 ship price 4.90, 7
also i get your point, 7
i 'm not a lawyer, 7
it infrastructure m w d, 7
strohgranulat item number 15108 vendor, 7
price eur16.90 ship price 4.90, 7
it 's time to shine, 7
gamer hyperx fury s speed, 7
the mercedes-amg e 53 4matic, 7
1728 item number phone vendor, 7
rocket internet se inh on, 7
uv filter cameras direct australia, 7
u got a point there, 7
manager m w d n-tv, 7
tom hanks in cast away, 7
de halloween puro baile funk, 7
problem child at man united, 7
5337 item number phone vendor, 7
united states securities and exchange, 7
string quartet from tchaikovsky p.i., 7
i do n't know him, 7
when will i be loved, 7
+++ breaking +++ breaking +++, 7
you reap what you sow, 7
i 'm at hyperspace one, 7
i feel so called out, 7
bremenfriburgo union berlinhertha berlin 3, 7
restaurant & hotel guide 2020, 7
phone item number 1104190000037-104 vendor, 7
price eur23.92 ship price 5.00, 7
11587 item number 22511587-100 vendor, 7
price eur124.00 lp-416 channel chaser, 7
lx550 item number 15108 vendor, 7
price eur38.06 ship price 5.70, 7
i would like to see, 7
5758 item number phone vendor, 7
4638 item number phone vendor, 7
original full version cd so, 7
ou item number 185ou-5039 vendor, 7
price eur22.45 eat in style, 7
8386 item number phone vendor, 7
i 'm running out of, 7
ebony item number 227ebony-0242 vendor, 7
critique de la raison negre, 7
price eur44.95 ship price 3.95, 7
1766 item number phone vendor, 7
germany + 49 89 phone, 7
pd item number 185pd-7049 vendor, 7
price eur16.70 ship price 5.00, 7
price eur117.95 ship price 3.95, 7
item number 4635 vendor dertour, 7
but i beg to differ, 7
703 item number 118247703-29 vendor, 7
out of the box thinking, 7
kaguya sama love is war, 7
it 's a whole mood, 7
like i get the point, 7
21900 item number 21121900-1 vendor, 7
one topic at a time, 7
lets get ready to rumble, 7
'll fix that for you, 7
i got used to it, 7
1793 item number 35-25 vendor, 7
rally round the flag effect, 7
sweat a la la long, 7
thought it was a drought, 7
the end will be spectacular, 7
dryfit bright rise 365 tk, 7
i am working on it, 7
in the heat of the, 7
8882-342 item number 2191-1 vendor, 7
w item number 15108 vendor, 7
sunset item number 227sunset-0001 vendor, 7
7223-250 item number 15108 vendor, 7
lhz item number 3344140004564-101 vendor, 7
it 's a beautiful world, 7
1339-51 item number 152133951-8 vendor, 7
6805-50 item number 152680550-1 vendor, 7
but i do n't judge, 7
league of legends wild rift, 7
herrenoberbeklei item number 327506-f007 vendor, 7
1,10 dollar new york dpa-afx, 7
what a load of rubbish, 7
2295-49 item number 139229549-00 vendor, 7
7224-600 item number 15108 vendor, 7
phone item number 1104190000043-104 vendor, 7
what a nice present from, 7
teenager riding dick wearing socks, 7
sold another clip high heels, 7
8653 item number phone vendor, 7
vogeley item number phone vendor, 7
enjoying sunset in the dunes, 7
young girl sucks big cock, 7
104-955 item number 146104955-01 vendor, 7
phone item number 1834090000191-900 vendor, 7
red dead redemption 2 pc, 7
& partners global citizen award, 7
best fortnite chapter 2 guide, 7
centre for feminist foreign policy, 7
just chillin in lobby cuz, 7
50cm item number 15108 vendor, 7
junior item number phone vendor, 7
the only way is up, 7
everything i wanted out now, 7
8890 item number 119c008890ndx0292-c0001 vendor, 7
like who gives a shit, 7
as i lay me down, 7
pv item number 185pv-7049 vendor, 7
price eur22.45 citystyle to go, 7
2802-82 item number 152280282-0 vendor, 7
ne comfort zone rt innovation, 7
i mean i feel you, 7
i 'm going deeper underground, 7
price eur61.85 ship price 5.00, 7
5155-51 item number 152515551-8 vendor, 7
with taptapsee download on itunes, 7
germ.must be perish for ever., 7
price eur74.95 ship price 3.95, 7
8092 item number phone vendor, 7
best clip ever on my, 7
b3.7570 item number 305b37570-10 vendor, 7
9469 item number phone vendor, 7
i 'm looking for a, 7
ot item number 185ot-5039 vendor, 7
price eur13.45 eat in style, 7
70220 item number 21170220-23 vendor, 7
16790 item number 119c016790ndx0766-c3503 vendor, 7
1752 item number phone vendor, 7
last of us part i, 7
mission impossible 7 & 8, 7
price eur23.80 ship price 0.00, 7
8228 item number phone vendor, 7
2731 item number phone vendor, 7
but i try my best, 7
phone item number 3344140004532-106 vendor, 7
master z the ip man, 7
im she is a rider, 7
gridley item number 227gridley-0011 vendor, 7
price eur17.10 spirit media black, 7
price eur68.99 ship price 0.00, 7
ppc ads in a nutshell, 7
with an e season 4, 7
& have a nice day, 7
i 'm at tennis club, 7
item number 932 vendor dertour, 7
conference on the future of, 7
b3.0883 item number 305b30883-10 vendor, 7
i do n't speak broke, 7
apple ipad air 2 64gb, 7
drama pieces of a woman, 7
i am fine with that, 7
a weng en a weng, 7
price eur18.67 ship price 5.00, 7
save the date am 8, 7
70242 item number 21170242-1 vendor, 7
b00-401 item number 2427-20 vendor, 7
price eur16.95 ship price 3.95, 7
i say go for it, 7
oh come all ye faithful, 7
21899 item number 21121899-1 vendor, 7
12927 item number 21012927-844 vendor, 7
2674 item number phone vendor, 7
thank you for following me, 7
system engineer w m d, 7
a volcanic eruption in space, 7
49307 item number phone vendor, 7
jenny jenny dreams are ten, 7
70242 item number 21170242-23 vendor, 7
professional 2 x 30 watt, 7
0479-49 item number 139047949-00 vendor, 7
5112-05 item number 105112-202 vendor, 7
who killed the electric car, 7
02 item number 139000602-00 vendor, 7
& controlling m w d, 7
19593 item number phone vendor, 7
i can feel it coming, 7
dinner for one fun fact, 7
i like it like that, 7
b3.5921 item number 305b35921-11 vendor, 7
12399 item number 21012399-133 vendor, 7
to kill a mocking bird, 7
run the risk of winning, 7
2521 bill and stop west, 7
123-91 item number phone vendor, 7
100g item number 15108 vendor, 7
price eur30.75 ship price 5.00, 7
but it 's a fact, 7
it 's a christmas miracle, 7
i did a little something, 7
luxury automobile brand established by, 7
all i want for is, 7
turns out i was wrong, 7
ag holding modecenterstrasse 22 a-1030, 7
1290-05 item number 152129005-0 vendor, 7
30444 item number 21130444-1 vendor, 7
album leak download download album, 7
guns n roses live in, 7
km very under graded rare, 7
oh yeah it's a friday, 7
11580 item number 22511580-100 vendor, 7
4642 item number phone vendor, 7
0170 item number 119c000170ndx0314-c0001 vendor, 7
1152 item number phone vendor, 7
11430 item number 22511430-500 vendor, 7
a cabinet secret guy boothby, 7
a cry in the night, 7
secret service ten o'clock postman, 7
lazing on a sunday afternoon, 7
item number 110757 vendor touridat, 7
secure access service edge sase, 7
8760 item number phone vendor, 7
i dont get your point, 7
i do n't feel it, 7
nverted pyramid scheming weckddd dmend, 7
everybody had a hard year, 7
7 seconds ft. neneh cherry, 7
the boy and the beast, 7
5011-05 item number 80501105-202 vendor, 7
i want to go to, 7
1255-05 item number 80125505-202 vendor, 7
strength of a woman explicit, 7
all we need is love, 7
4425-05 item number 80442505-202 vendor, 7
92453-051 item number phone vendor, 7
i 'm gonna do it, 7
b3.6473 item number 305b36473-11 vendor, 7
like ok i get it, 7
wallet item number phone vendor, 7
omg i am so happy, 7
we 've got you covered, 7
phone item number 1104190000124-900 vendor, 7
hymn item number phone vendor, 7
101-97s item number 14610197s-01 vendor, 7
i do n't mind it, 7
1709m item number 1531709m-25 vendor, 7
i 'm at mun mun, 7
b00-101 item number 2421-20 vendor, 7
omg i 'm so happy, 7
high-end gaming pc 2 tickets, 7
1796a-skull item number phone vendor, 7
price eur45.50 down to earth, 7
good morning my sunshine hammer, 7
e-mail-newsletter has been published on, 7
click & collect krokodeals decathlon, 7
in the middle with you, 7
we live in a world, 7
original title favorite dead girl, 7
how to radicalize a normie, 7
i guess you 're right, 7
findom find finsub moneydom goddess, 7
seton academy join the pack, 7
< phone > o 8240, 7
item number 114047 vendor touridat, 7
i just registered for bon-smash, 7
i do n't know who, 7
2829-78 item number 152282978-1 vendor, 7
i 'm looking forward to, 7
dz bank ag m &, 7
ltd eclipse 87 nt pw, 7
price eur39.90 ship price 4.90, 7
a beautiful place to drown, 7
pack 6 x 400 g, 7
warriors of the world united, 7
bye scuscurr voom bye bye, 7
how i let your mother, 7
all i hear is mimimi, 7
no i dont think so, 7
a personal introduction by leona, 7
in red dead redemption 2, 7
have a happy new year, 7
como se diz em alemao, 7
oe item number 185oe-7009 vendor, 7
it 's a little bit, 7
and the problem of phenomena, 7
cyber knights a cyberpunk rpg, 7
where do i sign up, 7
sparkle with all your heart, 7
all creatures great and small, 7
when i rule the world, 7
woke a guide to social, 7
thinking digital health forward foresight, 7
is now a porn star, 7
on the switch and a, 7
amd am4 + processador amd, 7
a home away from home, 7
dancing in the lesbian bar, 7
is a graffiti artist for, 7
one piece pirate warriors 4, 7
in a very good way, 7
what can i say except, 7
adidas performance predator 19.3 tf, 7
maybe i do n't know, 7
the world is on fire, 7
5 tags tagged by colour, 7
i just do n't understand, 7
i 'm ready to go, 7
u deserve so much better, 7
to add insult to injury, 7
1753 item number phone vendor, 7
15.6 inch 8gb + 256gb, 7
i wish i was lying, 7
students for a democratic society, 7
new york times washington post, 7
now it 's your turn, 7
last of us part 2, 7
core i7 used excellent condition, 7
app to good to go, 7
i can relate to this, 7
okay i 'll do it, 7
43 in 2020 stand 13.03, 7
wtf is wrong with people, 7
more songs on my hashtag, 7
hello i 'm the doctor, 7
i fucking told you so, 7
how am i supposed to, 7
blowjob rt f u nna, 7
great place to work 2020, 7
this is how u feel, 7
cube reaction hybrid ex 625, 7
isd art 6 i e, 7
i hate it in here, 7
how did i go from, 7
pic vodka blyad cevape ajmo, 7
playstation 5 xbox series x, 7
cube access hybrid one phone, 7
something i got from reddit, 7
in live live stream liverpool, 7
time to say good night, 7
germany we have a problem, 7
deep purple child in time, 7
do 's & dont 's, 7
powerstroke 3 colortone yellow bass, 7
winning a for and performing, 7
never give up on me, 7
the who i 'm free, 7
crucial 2gb upgrade for a, 7
1154-61 item number 152115461-2 vendor, 7
cool cool cool cool cool, 7
that 's a no no, 7
one of us is next, 7
it is wednesday my dudes, 7
vip supporter m w d, 7
and i 'm not mad, 7
if i die i die, 7
wish you a wonderful day, 7
by durma hd-fs 3015 phone, 7
ui designer m w d, 7
mv making + 16p photobook, 7
i am today years old, 7
we are one a global, 7
i bluetooth i in-ear i, 7
dedicated as a service rdaas, 7
ebay led-tv lg 60um71007lb 4k, 7
i 'm surrounded by idiots, 7
what am i looking at, 7
i love you a lot, 7
have a nice sunday evening, 7
union agency for fundamental rights, 7
wickremesekera carmel catholic high school, 7
return of the living dead, 7
